keyword,url,title,content,author,publisher,description,publish_date
Muhaimin Iskandar,https://news.google.com/rss/articles/CBMid2h0dHBzOi8vbmFzaW9uYWwub2tlem9uZS5jb20vcmVhZC8yMDIzLzAxLzA2LzMzNy8yNzQxMjc5L3NpYXBhLWl0dS1ndXMtbXVoYWltaW4taXNrYW5kYXItdGVybnlhdGEtcHVueWEtamFiYXRhbi1wZW50aW5n0gF2aHR0cHM6Ly9uYXNpb25hbC5va2V6b25lLmNvbS9hbXAvMjAyMy8wMS8wNi8zMzcvMjc0MTI3OS9zaWFwYS1pdHUtZ3VzLW11aGFpbWluLWlza2FuZGFyLXRlcm55YXRhLXB1bnlhLWphYmF0YW4tcGVudGluZw?oc=5&hl=en-ID&gl=ID&ceid=ID:en,Siapa Itu Gus Muhaimin Iskandar? Ternyata Punya Jabatan Penting - Okezone News,,,Okezone News,Siapa Itu Gus Muhaimin Iskandar? Ternyata Punya Jabatan Penting  Okezone News,"Fri, 06 Jan 2023 08:00:00 GMT"
Muhaimin Iskandar,https://news.google.com/rss/articles/CBMic2h0dHBzOi8vd3d3LmRpYWxla3Npcy5jb20vbmFzaW9uYWwvcGtiLWRpa2FiYXJrYW4tbWVyYXBhdC1rZS1rb2FsaXNpLW5hc2RlbS1rZXR1bS1wa2ItbWFzaWgtc2V0aWEtYmVyc2FtYS1nZXJpbmRyYS_SAQA?oc=5&hl=en-ID&gl=ID&ceid=ID:en,"PKB Dikabarkan Merapat ke Koalisi NasDem, Ketum PKB: Masih ... - Dialeksis",,,Dialeksis,"PKB Dikabarkan Merapat ke Koalisi NasDem, Ketum PKB: Masih ...  Dialeksis","Sun, 08 Jan 2023 08:00:00 GMT"
Muhaimin Iskandar,https://news.google.com/rss/articles/CBMiW2h0dHBzOi8vd3d3Lmphd2Fwb3MuY29tL3BvbGl0aWsvMDE0MjkzMDkvb2dhaC1iZXJwYWxpbmctY2FrLWltaW4tbWFzaWgtdHVuZ2d1LWthYmFyLXByYWJvd2_SAV9odHRwczovL3d3dy5qYXdhcG9zLmNvbS9wb2xpdGlrL2FtcC8wMTQyOTMwOS9vZ2FoLWJlcnBhbGluZy1jYWstaW1pbi1tYXNpaC10dW5nZ3Uta2FiYXItcHJhYm93bw?oc=5&hl=en-ID&gl=ID&ceid=ID:en,"Ogah Berpaling, Cak Imin Masih Tunggu Kabar Prabowo - Jawa Pos - JawaPos",,,JawaPos,"Ogah Berpaling, Cak Imin Masih Tunggu Kabar Prabowo - Jawa Pos  JawaPos","Sun, 08 Jan 2023 08:00:00 GMT"
Muhaimin Iskandar,https://news.google.com/rss/articles/CBMicWh0dHBzOi8vbmV3cy5kZXRpay5jb20vcGVtaWx1L2QtNjUwNDEzMy9yZXNwb25zLWNhay1pbWluLXNvYWwtaXN1LWphamFrLWtvYWxpc2ktYmFyZW5nLW5hc2RlbS1qYWRpLWNhd2FwcmVzLWFuaWVz0gF1aHR0cHM6Ly9uZXdzLmRldGlrLmNvbS9wZW1pbHUvZC02NTA0MTMzL3Jlc3BvbnMtY2FrLWltaW4tc29hbC1pc3UtamFqYWsta29hbGlzaS1iYXJlbmctbmFzZGVtLWphZGktY2F3YXByZXMtYW5pZXMvYW1w?oc=5&hl=en-ID&gl=ID&ceid=ID:en,Respons Cak Imin soal Isu Jajak Koalisi Bareng NasDem Jadi Cawapres Anies - detikNews,,,detikNews,Respons Cak Imin soal Isu Jajak Koalisi Bareng NasDem Jadi Cawapres Anies  detikNews,"Sun, 08 Jan 2023 08:00:00 GMT"
Muhaimin Iskandar,https://news.google.com/rss/articles/CBMiaWh0dHBzOi8vd3d3LmFudGFyYW5ld3MuY29tL2Jlcml0YS8zMzQwNTk2L211aGFpbWluLXRlZ2Fza2FuLXBrYi10b2xhay1zaXN0ZW0tcHJvcG9yc2lvbmFsLXRlcnR1dHVwLXBlbWlsddIBa2h0dHBzOi8vbS5hbnRhcmFuZXdzLmNvbS9hbXAvYmVyaXRhLzMzNDA1OTYvbXVoYWltaW4tdGVnYXNrYW4tcGtiLXRvbGFrLXNpc3RlbS1wcm9wb3JzaW9uYWwtdGVydHV0dXAtcGVtaWx1?oc=5&hl=en-ID&gl=ID&ceid=ID:en,Muhaimin tegaskan PKB tolak sistem proporsional tertutup pemilu - ANTARA,,,ANTARA,Muhaimin tegaskan PKB tolak sistem proporsional tertutup pemilu  ANTARA,"Sun, 08 Jan 2023 08:00:00 GMT"
Muhaimin Iskandar,https://news.google.com/rss/articles/CBMif2h0dHBzOi8vd3d3LnRyaWJ1bm5ld3MuY29tL25hc2lvbmFsLzIwMjMvMDEvMDgva2V0dWEtdW11bS1wa2ItbXVoYWltaW4taXNrYW5kYXItcGltcGluLXBlbmFuZGF0YW5nYW5hbi1wZXRpc2ktcGVybGluZHVuZ2FuLWFuYWvSAYEBaHR0cHM6Ly9tLnRyaWJ1bm5ld3MuY29tL2FtcC9uYXNpb25hbC8yMDIzLzAxLzA4L2tldHVhLXVtdW0tcGtiLW11aGFpbWluLWlza2FuZGFyLXBpbXBpbi1wZW5hbmRhdGFuZ2FuYW4tcGV0aXNpLXBlcmxpbmR1bmdhbi1hbmFr?oc=5&hl=en-ID&gl=ID&ceid=ID:en,Ketua Umum PKB Muhaimin Iskandar Pimpin Penandatanganan Petisi Perlindungan Anak - Tribunnews.com,,,Tribunnews.com,Ketua Umum PKB Muhaimin Iskandar Pimpin Penandatanganan Petisi Perlindungan Anak  Tribunnews.com,"Sun, 08 Jan 2023 08:00:00 GMT"
Muhaimin Iskandar,https://news.google.com/rss/articles/CBMifGh0dHBzOi8vbmFzaW9uYWwua29tcGFzLmNvbS9yZWFkLzIwMjMvMDEvMDMvMDkyNjMyMTEvYnVrYS1wZWx1YW5nLWRlbmdhbi1uYXNkZW0tcGtiLWRpbmlsYWktdGFrLXB1YXMtZGVuZ2FuLWdlcmluZHJhLXRlcmthaXTSAYABaHR0cHM6Ly9hbXAua29tcGFzLmNvbS9uYXNpb25hbC9yZWFkLzIwMjMvMDEvMDMvMDkyNjMyMTEvYnVrYS1wZWx1YW5nLWRlbmdhbi1uYXNkZW0tcGtiLWRpbmlsYWktdGFrLXB1YXMtZGVuZ2FuLWdlcmluZHJhLXRlcmthaXQ?oc=5&hl=en-ID&gl=ID&ceid=ID:en,"Buka Peluang dengan Nasdem, PKB Dinilai Tak Puas dengan Gerindra Terkait Muhaimin - Kompas.com - Nasional Kompas.com",,,Nasional Kompas.com,"Buka Peluang dengan Nasdem, PKB Dinilai Tak Puas dengan Gerindra Terkait Muhaimin - Kompas.com  Nasional Kompas.com","Tue, 03 Jan 2023 08:00:00 GMT"
Muhaimin Iskandar,https://news.google.com/rss/articles/CBMiYmh0dHBzOi8vbmV3cy5kZXRpay5jb20vYmVyaXRhL2QtNjQ5NzQ2Mi9jYWstaW1pbi1hcHJlc2lhc2ktbGFuZ2thaC1qb2tvd2ktc29hbC1wZW51cnVuYW4taGFyZ2EtYmJt0gFmaHR0cHM6Ly9uZXdzLmRldGlrLmNvbS9iZXJpdGEvZC02NDk3NDYyL2Nhay1pbWluLWFwcmVzaWFzaS1sYW5na2FoLWpva293aS1zb2FsLXBlbnVydW5hbi1oYXJnYS1iYm0vYW1w?oc=5&hl=en-ID&gl=ID&ceid=ID:en,Cak Imin Apresiasi Langkah Jokowi soal Penurunan Harga BBM - detikNews,,,detikNews,Cak Imin Apresiasi Langkah Jokowi soal Penurunan Harga BBM  detikNews,"Wed, 04 Jan 2023 08:00:00 GMT"
Muhaimin Iskandar,https://news.google.com/rss/articles/CBMia2h0dHBzOi8vbmV3cy5kZXRpay5jb20vYmVyaXRhL2QtNjQ5OTk5NS9jYWstaW1pbi1taW50YS1wZW1lcmludGFoLXBlcmtldGF0LWFrc2VzLW1hc3VrLXBlbGFuY29uZy1hc2FsLWNoaW5h0gFvaHR0cHM6Ly9uZXdzLmRldGlrLmNvbS9iZXJpdGEvZC02NDk5OTk1L2Nhay1pbWluLW1pbnRhLXBlbWVyaW50YWgtcGVya2V0YXQtYWtzZXMtbWFzdWstcGVsYW5jb25nLWFzYWwtY2hpbmEvYW1w?oc=5&hl=en-ID&gl=ID&ceid=ID:en,Cak Imin Minta Pemerintah Perketat Akses Masuk Pelancong Asal China - detikNews,,,detikNews,Cak Imin Minta Pemerintah Perketat Akses Masuk Pelancong Asal China  detikNews,"Thu, 05 Jan 2023 08:00:00 GMT"
Muhaimin Iskandar,https://news.google.com/rss/articles/CBMiZWh0dHBzOi8vbmV3cy5kZXRpay5jb20vYmVyaXRhL2QtNjUwMzM3Ni9iYXJlbmcta2lhaS1zYWlkLWNhay1pbWluLWhhZGlyaS1oYXVsLWtoci16YW1ydWRkaW4tZGktc2xlbWFu0gFpaHR0cHM6Ly9uZXdzLmRldGlrLmNvbS9iZXJpdGEvZC02NTAzMzc2L2JhcmVuZy1raWFpLXNhaWQtY2FrLWltaW4taGFkaXJpLWhhdWwta2hyLXphbXJ1ZGRpbi1kaS1zbGVtYW4vYW1w?oc=5&hl=en-ID&gl=ID&ceid=ID:en,"Bareng Kiai Said, Cak Imin Hadiri Haul KHR Zamruddin di Sleman - detikNews",,,detikNews,"Bareng Kiai Said, Cak Imin Hadiri Haul KHR Zamruddin di Sleman  detikNews","Sat, 07 Jan 2023 08:00:00 GMT"
Muhaimin Iskandar,https://news.google.com/rss/articles/CBMiXWh0dHBzOi8vc29sb3JheWEuc29sb3Bvcy5jb20vcGFuYXNpLW1lc2luLXBrYi13b25vZ2lyaS1wZXNhbi1jYWstaW1pbi1yYXBpa2FuLWJhcmlzYW4tMTUxODA1NtIBYWh0dHBzOi8vc29sb3JheWEuc29sb3Bvcy5jb20vcGFuYXNpLW1lc2luLXBrYi13b25vZ2lyaS1wZXNhbi1jYWstaW1pbi1yYXBpa2FuLWJhcmlzYW4tMTUxODA1Ni9hbXA?oc=5&hl=en-ID&gl=ID&ceid=ID:en,"Panasi Mesin PKB Wonogiri, Pesan Cak Imin: Rapikan Barisan! - Soloraya Solopos.com",,,Soloraya Solopos.com,"Panasi Mesin PKB Wonogiri, Pesan Cak Imin: Rapikan Barisan!  Soloraya Solopos.com","Sat, 07 Jan 2023 08:00:00 GMT"
Muhaimin Iskandar,https://news.google.com/rss/articles/CBMia2h0dHBzOi8vd3d3LnRyaWJ1bm5ld3MuY29tL21hdGEtbG9rYWwtbWVtaWxpaC8yMDIzLzAxLzA2L3BlcmVtcHVhbi1iYW5nc2Etc2lhcC1tZW5hbmdrYW4tcGtiLWRpLXBlbWlsdS0yMDI00gFtaHR0cHM6Ly9tLnRyaWJ1bm5ld3MuY29tL2FtcC9tYXRhLWxva2FsLW1lbWlsaWgvMjAyMy8wMS8wNi9wZXJlbXB1YW4tYmFuZ3NhLXNpYXAtbWVuYW5na2FuLXBrYi1kaS1wZW1pbHUtMjAyNA?oc=5&hl=en-ID&gl=ID&ceid=ID:en,Perempuan Bangsa Siap Menangkan PKB di Pemilu 2024 - Tribunnews.com,,,Tribunnews.com,Perempuan Bangsa Siap Menangkan PKB di Pemilu 2024  Tribunnews.com,"Fri, 06 Jan 2023 08:00:00 GMT"
Muhaimin Iskandar,https://news.google.com/rss/articles/CBMigAFodHRwczovL25ld3MucmVwdWJsaWthLmNvLmlkL2Jlcml0YS9ybnV5dTU0MDkvd2FjYW5hLWJlcmdhYnVuZ255YS1wa2ItZGktdGVuZ2FoLWlzdS1zYW50ZXItcGtzLWFrYW4tdGluZ2dhbGthbi1rb2FsaXNpLXBlcnViYWhhbtIBAA?oc=5&hl=en-ID&gl=ID&ceid=ID:en,Wacana Bergabungnya PKB di Tengah Isu Santer PKS akan ... - Republika Online,,,Republika Online,Wacana Bergabungnya PKB di Tengah Isu Santer PKS akan ...  Republika Online,"Mon, 02 Jan 2023 08:00:00 GMT"
Muhaimin Iskandar,https://news.google.com/rss/articles/CBMia2h0dHBzOi8vd3d3LmFudGFyYW5ld3MuY29tL2Jlcml0YS8zMzM3MTY3L25hc2RlbS1iYW50YWgtam9obm55LXBsYXRlLW11bmR1ci1kYXJpLWphYmF0YW4tc2ViYWdhaS1tZW5rb21pbmZv0gFtaHR0cHM6Ly9tLmFudGFyYW5ld3MuY29tL2FtcC9iZXJpdGEvMzMzNzE2Ny9uYXNkZW0tYmFudGFoLWpvaG5ueS1wbGF0ZS1tdW5kdXItZGFyaS1qYWJhdGFuLXNlYmFnYWktbWVua29taW5mbw?oc=5&hl=en-ID&gl=ID&ceid=ID:en,NasDem bantah Johnny Plate mundur dari jabatan sebagai Menkominfo - ANTARA,,,ANTARA,NasDem bantah Johnny Plate mundur dari jabatan sebagai Menkominfo  ANTARA,"Thu, 05 Jan 2023 08:00:00 GMT"
Muhaimin Iskandar,https://news.google.com/rss/articles/CBMib2h0dHBzOi8vd3d3LmFudGFyYW5ld3MuY29tL2Jlcml0YS8zMzMzODk0L2Rhc2NvLXBhcnBvbC1iZXJrZXNlbXBhdGFuLXNvc2lhbGlhc2ktbGViaWgtcGFkYS1wcm9wb3JzaW9uYWwtdGVyYnVrYdIBcWh0dHBzOi8vbS5hbnRhcmFuZXdzLmNvbS9hbXAvYmVyaXRhLzMzMzM4OTQvZGFzY28tcGFycG9sLWJlcmtlc2VtcGF0YW4tc29zaWFsaWFzaS1sZWJpaC1wYWRhLXByb3BvcnNpb25hbC10ZXJidWth?oc=5&hl=en-ID&gl=ID&ceid=ID:en,Dasco: Parpol berkesempatan sosialiasi lebih pada proporsional terbuka - ANTARA,,,ANTARA,Dasco: Parpol berkesempatan sosialiasi lebih pada proporsional terbuka  ANTARA,"Tue, 03 Jan 2023 08:00:00 GMT"
Muhaimin Iskandar,https://news.google.com/rss/articles/CBMiRGh0dHBzOi8vd3d3LndhcHJlc3JpLmdvLmlkL2t1YXRrYW4tcGVzYW50cmVuLXVudHVrLWtlbWFuZGlyaWFuLXVtYXQv0gEA?oc=5&hl=en-ID&gl=ID&ceid=ID:en,Kuatkan Pesantren untuk Kemandirian Umat - Wakil Presiden ... - Wakil Presiden Republik Indonesia,,,Wakil Presiden Republik Indonesia,Kuatkan Pesantren untuk Kemandirian Umat - Wakil Presiden ...  Wakil Presiden Republik Indonesia,"Sat, 07 Jan 2023 08:00:00 GMT"
Muhaimin Iskandar,https://news.google.com/rss/articles/CBMiX2h0dHBzOi8va2JhbmV3cy5jb20vZ2VsaWF0LWRhZXJhaC93YWgta2VyZW4tcmF0dXNhbi13YXJ1bmctYW5pZXMtYmFzd2VkYW4taGFkaXItZGktcHJvYm9saW5nZ28v0gEA?oc=5&hl=en-ID&gl=ID&ceid=ID:en,"Wah Keren, Ratusan Warung Anies Baswedan Hadir di Probolinggo ... - KBA NEWS",,,KBA NEWS,"Wah Keren, Ratusan Warung Anies Baswedan Hadir di Probolinggo ...  KBA NEWS","Thu, 05 Jan 2023 08:00:00 GMT"
Muhaimin Iskandar,https://news.google.com/rss/articles/CBMiaGh0dHBzOi8va2JhbmV3cy5jb20vZ2VsaWF0LWRhZXJhaC95ZWwteWVsLWFuaWVzLWJhc3dlZGFuLXByZXNpZGVuLW1lbmdnZW1hLXNhYXQtamFsYW4tc2VoYXQtZGktcGFzdXJ1YW4v0gEA?oc=5&hl=en-ID&gl=ID&ceid=ID:en,Yel-yel Anies Baswedan Presiden Menggema saat Jalan Sehat di ... - KBA NEWS,,,KBA NEWS,Yel-yel Anies Baswedan Presiden Menggema saat Jalan Sehat di ...  KBA NEWS,"Sun, 01 Jan 2023 08:00:00 GMT"
Muhaimin Iskandar,https://news.google.com/rss/articles/CBMiY2h0dHBzOi8va2JhbmV3cy5jb20vc2VuZ2dhbmcvZHVhLXRlcm9ib3Nhbi1hbmllcy1iYXN3ZWRhbi1zYWF0LW1lbmphYmF0LWtldHVhLXNlbmF0LXVnbS15b2d5YWthcnRhL9IBAA?oc=5&hl=en-ID&gl=ID&ceid=ID:en,Dua Terobosan Anies Baswedan Saat Menjabat Ketua Senat UGM ... - KBA NEWS,,,KBA NEWS,Dua Terobosan Anies Baswedan Saat Menjabat Ketua Senat UGM ...  KBA NEWS,"Mon, 09 Jan 2023 08:00:00 GMT"
Muhaimin Iskandar,https://news.google.com/rss/articles/CBMihQFodHRwczovL2tiYW5ld3MuY29tL2dlbGlhdC1kYWVyYWgvc2VtYW5nYXQtbWFzcnVsLWthbWlsLWxpYnVyYW4tcHVsa2FtLWtlLXN1bXNlbC1zb3NpYWxpYXNpa2FuLWFuaWVzLXNla2FsaWd1cy1iZW50dWstc2ltcHVsLXJlbGF3YW4v0gEA?oc=5&hl=en-ID&gl=ID&ceid=ID:en,"Semangat Masrul Kamil, Liburan Pulkam ke Sumsel Sosialiasikan ... - KBA NEWS",,,KBA NEWS,"Semangat Masrul Kamil, Liburan Pulkam ke Sumsel Sosialiasikan ...  KBA NEWS","Mon, 02 Jan 2023 08:00:00 GMT"
Muhaimin Iskandar,https://news.google.com/rss/articles/CBMiZmh0dHBzOi8va2JhbmV3cy5jb20vc2VuZ2dhbmcvY2VyaXRhLXRlbWFuLXVnbS1kYXJpLXBlcnRlbXVhbi1wZXJ0YW1hLW1lcmFzYWthbi1rYXJpc21hLWFuaWVzLWJhc3dlZGFuL9IBAA?oc=5&hl=en-ID&gl=ID&ceid=ID:en,"Cerita Teman UGM, dari Pertemuan Pertama Merasakan Karisma ... - KBA NEWS",,,KBA NEWS,"Cerita Teman UGM, dari Pertemuan Pertama Merasakan Karisma ...  KBA NEWS","Sat, 07 Jan 2023 08:00:00 GMT"
Muhaimin Iskandar,https://news.google.com/rss/articles/CBMib2h0dHBzOi8vbmFzaW9uYWwudGVtcG8uY28vcmVhZC8xNjc0OTM0L2FuaWVzLWJhc3dlZGFuLXJldmlldy1maWxtLXNvYWwta3JpbWluYWxpc2FzaS1oaW5nZ2EtcGVsZW1haGFuLWRlbW9rcmFzadIBbmh0dHBzOi8vbmFzaW9uYWwudGVtcG8uY28vYW1wLzE2NzQ5MzQvYW5pZXMtYmFzd2VkYW4tcmV2aWV3LWZpbG0tc29hbC1rcmltaW5hbGlzYXNpLWhpbmdnYS1wZWxlbWFoYW4tZGVtb2tyYXNp?oc=5&hl=en-ID&gl=ID&ceid=ID:en,Anies Baswedan Review Film soal Kriminalisasi hingga Pelemahan Demokrasi - Nasional Tempo,,,Nasional Tempo,Anies Baswedan Review Film soal Kriminalisasi hingga Pelemahan Demokrasi  Nasional Tempo,"Mon, 02 Jan 2023 08:00:00 GMT"
Muhaimin Iskandar,https://news.google.com/rss/articles/CBMiWmh0dHBzOi8va2JhbmV3cy5jb20vZ2VsaWF0LWRhZXJhaC9zaW1wdWwtcmVsYXdhbi1kaS1qYXRlbmctYmVydGVtdS1iYWhhcy1wZW1lbmFuZ2FuLWFuaWVzL9IBAA?oc=5&hl=en-ID&gl=ID&ceid=ID:en,Simpul Relawan di Jateng Bertemu Bahas Pemenangan Anies ... - KBA NEWS,,,KBA NEWS,Simpul Relawan di Jateng Bertemu Bahas Pemenangan Anies ...  KBA NEWS,"Tue, 03 Jan 2023 08:00:00 GMT"
Muhaimin Iskandar,https://news.google.com/rss/articles/CBMibmh0dHBzOi8vbmFzaW9uYWwudGVtcG8uY28vcmVhZC8xNjc2ODEzL3Bhc3BhbXByZXMtYWthbi1sZWJpaC1odW1hbmlzLXNhYXQtbWVuZ2F3YWwtcHJlc2lkZW4tZGFuLXdha2lsLXByZXNpZGVu0gFtaHR0cHM6Ly9uYXNpb25hbC50ZW1wby5jby9hbXAvMTY3NjgxMy9wYXNwYW1wcmVzLWFrYW4tbGViaWgtaHVtYW5pcy1zYWF0LW1lbmdhd2FsLXByZXNpZGVuLWRhbi13YWtpbC1wcmVzaWRlbg?oc=5&hl=en-ID&gl=ID&ceid=ID:en,Paspampres Akan Lebih Humanis saat Mengawal Presiden dan Wakil Presiden - Nasional Tempo,,,Nasional Tempo,Paspampres Akan Lebih Humanis saat Mengawal Presiden dan Wakil Presiden  Nasional Tempo,"Sat, 07 Jan 2023 08:00:00 GMT"
Muhaimin Iskandar,https://news.google.com/rss/articles/CBMiYWh0dHBzOi8vd3d3LmFudGFyYW5ld3MuY29tL2Jlcml0YS8zMzM4NTY4L2J1cGF0aS1uZ2FuanVrLXJlc21pa2FuLWdlcmFrYW4tdWktbWVuZ2FqYXItYW5na2F0YW4tMTLSAWNodHRwczovL20uYW50YXJhbmV3cy5jb20vYW1wL2Jlcml0YS8zMzM4NTY4L2J1cGF0aS1uZ2FuanVrLXJlc21pa2FuLWdlcmFrYW4tdWktbWVuZ2FqYXItYW5na2F0YW4tMTI?oc=5&hl=en-ID&gl=ID&ceid=ID:en,Bupati Nganjuk resmikan Gerakan UI Mengajar angkatan 12 - ANTARA,,,ANTARA,Bupati Nganjuk resmikan Gerakan UI Mengajar angkatan 12  ANTARA,"Fri, 06 Jan 2023 08:00:00 GMT"
Muhaimin Iskandar,https://news.google.com/rss/articles/CBMidmh0dHBzOi8vd3d3LmZhamFyLmNvLmlkLzIwMjMvMDEvMDUvZWZlay1la29yLWphcy1hbmllcy1uYXNkZW0tc3Vsc2VsLWJhcmFuZy15YW5nLWRpanVhbC1zYW5nYXQtbGFrdS1iYW55YWstcGVtaW5hdG55YS_SAXpodHRwczovL3d3dy5mYWphci5jby5pZC8yMDIzLzAxLzA1L2VmZWstZWtvci1qYXMtYW5pZXMtbmFzZGVtLXN1bHNlbC1iYXJhbmcteWFuZy1kaWp1YWwtc2FuZ2F0LWxha3UtYmFueWFrLXBlbWluYXRueWEvYW1wLw?oc=5&hl=en-ID&gl=ID&ceid=ID:en,"Efek Ekor Jas Anies, Nasdem Sulsel: Barang yang Dijual Sangat Laku, Banyak Peminatnya - FAJAR.CO.ID",,,FAJAR.CO.ID,"Efek Ekor Jas Anies, Nasdem Sulsel: Barang yang Dijual Sangat Laku, Banyak Peminatnya  FAJAR.CO.ID","Thu, 05 Jan 2023 08:00:00 GMT"
Muhaimin Iskandar,https://news.google.com/rss/articles/CBMiXGh0dHBzOi8vd3d3LmRldGlrLmNvbS9lZHUvZGV0aWtwZWRpYS9kLTY0OTYzMTIvcGVuZ2VydGlhbi1yZXRvcmlrYS10dWp1YW4tZGFuLWplbmlzLWplbmlzbnlh0gFgaHR0cHM6Ly93d3cuZGV0aWsuY29tL2VkdS9kZXRpa3BlZGlhL2QtNjQ5NjMxMi9wZW5nZXJ0aWFuLXJldG9yaWthLXR1anVhbi1kYW4tamVuaXMtamVuaXNueWEvYW1w?oc=5&hl=en-ID&gl=ID&ceid=ID:en,"Pengertian Retorika, Tujuan, dan Jenis-jenisnya - detikcom",,,detikcom,"Pengertian Retorika, Tujuan, dan Jenis-jenisnya  detikcom","Wed, 04 Jan 2023 08:00:00 GMT"
Muhaimin Iskandar,https://news.google.com/rss/articles/CBMiamh0dHBzOi8va2JhbmV3cy5jb20vc2VuZ2dhbmcvaW5pLWtldW5pa2FuLWt1Y2luZy1rdWNpbmctYW5pZXMtYmFzd2VkYW4tYWRhLXlhbmctaG9iaS1tYWluLWJhcmVuZy1pa2FuLWtvaS_SAQA?oc=5&hl=en-ID&gl=ID&ceid=ID:en,"Ini Keunikan Kucing-kucing Anies Baswedan, Ada yang Hobi Main ... - KBA NEWS",,,KBA NEWS,"Ini Keunikan Kucing-kucing Anies Baswedan, Ada yang Hobi Main ...  KBA NEWS","Thu, 05 Jan 2023 08:00:00 GMT"
Muhaimin Iskandar,https://news.google.com/rss/articles/CBMibWh0dHBzOi8vcmFkYXJzZWxhdGFuLmZhamFyLmNvLmlkLzIwMjMvMDEvMDgvaGFueWEtZW5hbS1uYW1hLXBlbnVoaS1rcml0ZXJpYS1jYWxvbi1wcmVzaWRlbi1wYWRhLXBpbHByZXMtMjAyNC_SAXFodHRwczovL3JhZGFyc2VsYXRhbi5mYWphci5jby5pZC8yMDIzLzAxLzA4L2hhbnlhLWVuYW0tbmFtYS1wZW51aGkta3JpdGVyaWEtY2Fsb24tcHJlc2lkZW4tcGFkYS1waWxwcmVzLTIwMjQvYW1wLw?oc=5&hl=en-ID&gl=ID&ceid=ID:en,Hanya Enam Nama Penuhi Kriteria Calon Presiden pada Pilpres 2024 - Radar Selatan,,,Radar Selatan,Hanya Enam Nama Penuhi Kriteria Calon Presiden pada Pilpres 2024  Radar Selatan,"Sun, 08 Jan 2023 08:00:00 GMT"
Muhaimin Iskandar,https://news.google.com/rss/articles/CBMiWWh0dHBzOi8vd3d3Lmdlc3VyaS5pZC9pbnRlcm5hbC9wdWFuLW1haGFyYW5pLXNlcmFoa2FuLWRpYXJpLXBvbGl0aWsta2UtbWVnYXdhdGktYjJoSmZaQnZ30gFdaHR0cHM6Ly93d3cuZ2VzdXJpLmlkL2FtcC9pbnRlcm5hbC9wdWFuLW1haGFyYW5pLXNlcmFoa2FuLWRpYXJpLXBvbGl0aWsta2UtbWVnYXdhdGktYjJoSmZaQnZ3?oc=5&hl=en-ID&gl=ID&ceid=ID:en,Puan Maharani Serahkan Diari Politik ke Megawati - www.gesuri.id,,,www.gesuri.id,Puan Maharani Serahkan Diari Politik ke Megawati  www.gesuri.id,"Fri, 06 Jan 2023 08:00:00 GMT"
Muhaimin Iskandar,https://news.google.com/rss/articles/CBMigQFodHRwczovL2tiYW5ld3MuY29tL2hvdC1uZXdzL3JlbGF3YW4tYW5pZXMtYmVyc2luYXItYmFueWFrLXRva29oLW51LWRpLWphdGltLWRhbi1qYXRlbmctbWVuZHVrdW5nLXdpcy13YXlhaGUtYW5pZXMtamFkaS1wcmVzaWRlbi_SAQA?oc=5&hl=en-ID&gl=ID&ceid=ID:en,Relawan Anies Bersinar: Banyak Tokoh NU di Jatim dan Jateng ... - KBA NEWS,,,KBA NEWS,Relawan Anies Bersinar: Banyak Tokoh NU di Jatim dan Jateng ...  KBA NEWS,"Sat, 07 Jan 2023 08:00:00 GMT"
Muhaimin Iskandar,https://news.google.com/rss/articles/CBMiiwFodHRwczovL2tiYW5ld3MuY29tL2dlbGlhdC1kYWVyYWgvYmVydGVrYWQtbWVuYW5na2FuLW11dGxhay1hbmllcy1kaS1qYWJhci1taW5nZ3UtbHVzYS1yZWxhd2FuLWFuaWVzLXAtMjQta2FidXBhdGVuLWJhbmR1bmctZGlkZWtsYXJhc2lrYW4v0gEA?oc=5&hl=en-ID&gl=ID&ceid=ID:en,"Bertekad Menangkan Mutlak Anies di Jabar, Minggu Lusa Relawan ... - KBA NEWS",,,KBA NEWS,"Bertekad Menangkan Mutlak Anies di Jabar, Minggu Lusa Relawan ...  KBA NEWS","Fri, 06 Jan 2023 08:00:00 GMT"
Muhaimin Iskandar,https://news.google.com/rss/articles/CBMicGh0dHBzOi8vcG9saXRpay5ybW9sLmlkL3JlYWQvMjAyMy8wMS8wNy81NTk2MTAvc3VmbWktZGFzY28tc2VrYmVyLWdlcmluZHJhLXBrYi1zZWdlcmEtZGlkZWtsYXJhc2lrYW4tcGVrYW4tZGVwYW7SAQA?oc=5&hl=en-ID&gl=ID&ceid=ID:en,Sufmi Dasco: Sekber Gerindra-PKB Segera Dideklarasikan Pekan ... - Rmol.id,,,Rmol.id,Sufmi Dasco: Sekber Gerindra-PKB Segera Dideklarasikan Pekan ...  Rmol.id,"Sat, 07 Jan 2023 08:00:00 GMT"
Muhaimin Iskandar,https://news.google.com/rss/articles/CBMiZGh0dHBzOi8vd3d3LmFudGFyYW5ld3MuY29tL2Jlcml0YS8zMzQwMjIxL21lbnRlcmktYmFobGlsLXRhcmdldC1pbnZlc3Rhc2ktcnAxNDAwLXRyaWxpdW4tdGlkYWstbXVkYWjSAWZodHRwczovL20uYW50YXJhbmV3cy5jb20vYW1wL2Jlcml0YS8zMzQwMjIxL21lbnRlcmktYmFobGlsLXRhcmdldC1pbnZlc3Rhc2ktcnAxNDAwLXRyaWxpdW4tdGlkYWstbXVkYWg?oc=5&hl=en-ID&gl=ID&ceid=ID:en,Menteri Bahlil: Target investasi Rp1.400 triliun tidak mudah - ANTARA,,,ANTARA,Menteri Bahlil: Target investasi Rp1.400 triliun tidak mudah  ANTARA,"Sat, 07 Jan 2023 08:00:00 GMT"
Muhaimin Iskandar,https://news.google.com/rss/articles/CBMiZ2h0dHBzOi8vbWVkYW5iaXNuaXNkYWlseS5jb20vbmV3cy9vbmxpbmUvcmVhZC8yMDIzLzAxLzA2LzE2NTIzNC9zYWlmdWxfc2FwcmlfcGtiX2hhcnVzX2JhbmdraXRfZGlfMjAyNC_SAQA?oc=5&hl=en-ID&gl=ID&ceid=ID:en,Saiful Sapri: PKB Harus Bangkit di 2024 - Deli Serdang - Binjai ... - Harian Medan Bisnis - Membangun Indonesia yang Lebih Baik,,,Harian Medan Bisnis - Membangun Indonesia yang Lebih Baik,Saiful Sapri: PKB Harus Bangkit di 2024 - Deli Serdang - Binjai ...  Harian Medan Bisnis - Membangun Indonesia yang Lebih Baik,"Fri, 06 Jan 2023 08:00:00 GMT"
Muhaimin Iskandar,https://news.google.com/rss/articles/CBMiUmh0dHBzOi8va2JhbmV3cy5jb20vc2VuZ2dhbmcvaXN0cmktd2lqaS10aHVrdWwtd2FmYXQtYW5pZXMtYmFzd2VkYW4tdHVydXQtYmVyZHVrYS_SAQA?oc=5&hl=en-ID&gl=ID&ceid=ID:en,"Istri Wiji Thukul Wafat, Anies Baswedan: Turut Berduka - KBA NEWS - KBA NEWS",,,KBA NEWS,"Istri Wiji Thukul Wafat, Anies Baswedan: Turut Berduka - KBA NEWS  KBA NEWS","Thu, 05 Jan 2023 08:00:00 GMT"
Muhaimin Iskandar,https://news.google.com/rss/articles/CBMie2h0dHBzOi8vZGF0YWJva3Mua2F0YWRhdGEuY28uaWQvZGF0YXB1Ymxpc2gvMjAyMy8wMS8wNS9zdXJ2ZWktaW5kaWthdG9yLWdhbmphci1wcmFub3dvLWJha2FsLWNhcHJlcy10ZXJrdWF0LXBhZGEtYWtoaXItMjAyMtIBAA?oc=5&hl=en-ID&gl=ID&ceid=ID:en,Survei Indikator: Ganjar Pranowo Bakal Capres Terkuat pada Akhir ... - Databoks.id,,,Databoks.id,Survei Indikator: Ganjar Pranowo Bakal Capres Terkuat pada Akhir ...  Databoks.id,"Thu, 05 Jan 2023 08:00:00 GMT"
Muhaimin Iskandar,https://news.google.com/rss/articles/CBMiZ2h0dHBzOi8va2JhbmV3cy5jb20vc2VuZ2dhbmcvY2VyaXRhLXBlcnNhaGFiYXRhbi1hbmllcy1iYXN3ZWRhbi1kZW5nYW4tc2VuaW1hbi1hc2FsLWJhbmR1bmcta2FuZy1yb3NpZC_SAQA?oc=5&hl=en-ID&gl=ID&ceid=ID:en,Cerita Persahabatan Anies Baswedan dengan Seniman Asal ... - KBA NEWS,,,KBA NEWS,Cerita Persahabatan Anies Baswedan dengan Seniman Asal ...  KBA NEWS,"Mon, 02 Jan 2023 08:00:00 GMT"
Muhaimin Iskandar,https://news.google.com/rss/articles/CBMidGh0dHBzOi8va2JhbmV3cy5jb20vZ2VsaWF0LWRhZXJhaC9yZWxhd2FuLWFuaWVzLWJhc3dlZGFuLWtvdGEtYm9nb3ItdGVyaW1hLXNrLWtlcGVuZ3VydXNhbi1kYW4tcGVtYmVrYWxhbi1zYWtzaS10cHMv0gEA?oc=5&hl=en-ID&gl=ID&ceid=ID:en,Relawan Anies Baswedan Kota Bogor Terima SK Kepengurusan ... - KBA NEWS,,,KBA NEWS,Relawan Anies Baswedan Kota Bogor Terima SK Kepengurusan ...  KBA NEWS,"Sat, 07 Jan 2023 08:00:00 GMT"
Muhaimin Iskandar,https://news.google.com/rss/articles/CBMid2h0dHBzOi8vbWV0cm8udGVtcG8uY28vcmVhZC8xNjc1NjM3L2d1eW9uLWhlcnUtYnVkaS1zYWF0LWRpdGFueWEtc29hbC1zdW11ci1yZXNhcGFuLXlhbmctZ2VuY2FyLWRpYmFuZ3VuLWFuaWVzLWJhc3dlZGFu0gF2aHR0cHM6Ly9tZXRyby50ZW1wby5jby9hbXAvMTY3NTYzNy9ndXlvbi1oZXJ1LWJ1ZGktc2FhdC1kaXRhbnlhLXNvYWwtc3VtdXItcmVzYXBhbi15YW5nLWdlbmNhci1kaWJhbmd1bi1hbmllcy1iYXN3ZWRhbg?oc=5&hl=en-ID&gl=ID&ceid=ID:en,Guyon Heru Budi Saat Ditanya Soal Sumur Resapan yang Gencar Dibangun Anies Baswedan - Metro Tempo,,,Metro Tempo,Guyon Heru Budi Saat Ditanya Soal Sumur Resapan yang Gencar Dibangun Anies Baswedan  Metro Tempo,"Wed, 04 Jan 2023 08:00:00 GMT"
Muhaimin Iskandar,https://news.google.com/rss/articles/CBMic2h0dHBzOi8va2JhbmV3cy5jb20vaG90LW5ld3MvcGVudWhpLWtyaXRlcmlhLXBlbWltcGluLXZpZGVvLXRlc3RpbW9uaS1hbmllcy10ZW50YW5nLWJqLWhhYmliaWUtZGktbWF0YS1uYWp3YS12aXJhbC_SAQA?oc=5&hl=en-ID&gl=ID&ceid=ID:en,"Penuhi Kriteria Pemimpin, Video Testimoni Anies tentang BJ ... - KBA NEWS",,,KBA NEWS,"Penuhi Kriteria Pemimpin, Video Testimoni Anies tentang BJ ...  KBA NEWS","Mon, 09 Jan 2023 08:00:00 GMT"
Muhaimin Iskandar,https://news.google.com/rss/articles/CBMifGh0dHBzOi8va2JhbmV3cy5jb20vc2VuZ2dhbmcvcHV0cmktY2hhaXJ1bC10YW5qdW5nLXRlcmluZ2F0LW1vbWVuLWJlcmtlc2FuLXNhYXQtZGlmb3RvLWJlcnNhbWEta2VsdWFyZ2Etb2xlaC1hbmllcy1iYXN3ZWRhbi_SAQA?oc=5&hl=en-ID&gl=ID&ceid=ID:en,Putri Chairul Tanjung Teringat Momen Berkesan saat Difoto ... - KBA NEWS,,,KBA NEWS,Putri Chairul Tanjung Teringat Momen Berkesan saat Difoto ...  KBA NEWS,"Fri, 06 Jan 2023 08:00:00 GMT"
Muhaimin Iskandar,https://news.google.com/rss/articles/CBMib2h0dHBzOi8vd3d3LmFudGFyYW5ld3MuY29tL2Jlcml0YS8zMzM1NTI2L3BlbWlsaWstcnVtYWgtbWV3YWgtdGVyYmVuZ2thbGFpLWphbGFuaS1wZXJhd2F0YW4tZGktcnNrZC1kdXJlbi1zYXdpdNIBcWh0dHBzOi8vbS5hbnRhcmFuZXdzLmNvbS9hbXAvYmVyaXRhLzMzMzU1MjYvcGVtaWxpay1ydW1haC1tZXdhaC10ZXJiZW5na2FsYWktamFsYW5pLXBlcmF3YXRhbi1kaS1yc2tkLWR1cmVuLXNhd2l0?oc=5&hl=en-ID&gl=ID&ceid=ID:en,Pemilik rumah mewah terbengkalai jalani perawatan di RSKD Duren Sawit - ANTARA,,,ANTARA,Pemilik rumah mewah terbengkalai jalani perawatan di RSKD Duren Sawit  ANTARA,"Wed, 04 Jan 2023 08:00:00 GMT"
Muhaimin Iskandar,https://news.google.com/rss/articles/CBMiYGh0dHBzOi8vd3d3LmFudGFyYW5ld3MuY29tL2Jlcml0YS8zMzM2MjQwL2R1by1zdXNhbnRvLW1lbWltcGluLXNlbGVrc2ktdGltLXBpYWxhLWRhdmlzLWluZG9uZXNpYdIBYmh0dHBzOi8vbS5hbnRhcmFuZXdzLmNvbS9hbXAvYmVyaXRhLzMzMzYyNDAvZHVvLXN1c2FudG8tbWVtaW1waW4tc2VsZWtzaS10aW0tcGlhbGEtZGF2aXMtaW5kb25lc2lh?oc=5&hl=en-ID&gl=ID&ceid=ID:en,Duo Susanto memimpin seleksi tim Piala Davis Indonesia - ANTARA,,,ANTARA,Duo Susanto memimpin seleksi tim Piala Davis Indonesia  ANTARA,"Wed, 04 Jan 2023 08:00:00 GMT"
Muhaimin Iskandar,https://news.google.com/rss/articles/CBMiX2h0dHBzOi8vd3d3LmFudGFyYW5ld3MuY29tL2Jlcml0YS8zMzQwODAzL3N1cnZlaS12b3hwb3B1bGktZWxla3RhYmlsaXRhcy1nb2xrYXItYWxhbWktcGVudXJ1bmFu0gFhaHR0cHM6Ly9tLmFudGFyYW5ld3MuY29tL2FtcC9iZXJpdGEvMzM0MDgwMy9zdXJ2ZWktdm94cG9wdWxpLWVsZWt0YWJpbGl0YXMtZ29sa2FyLWFsYW1pLXBlbnVydW5hbg?oc=5&hl=en-ID&gl=ID&ceid=ID:en,Survei Voxpopuli: Elektabilitas Golkar alami penurunan - ANTARA,,,ANTARA,Survei Voxpopuli: Elektabilitas Golkar alami penurunan  ANTARA,"Sun, 08 Jan 2023 08:00:00 GMT"
Muhaimin Iskandar,https://news.google.com/rss/articles/CBMiZGh0dHBzOi8va2JhbmV3cy5jb20vc2VuZ2dhbmcvb2xhaHJhZ2Etb3Rhay1hbmllcy1iYXN3ZWRhbi1hamFrLXB1dHJhbnlhLXRhbmRpbmctY2F0dXItZGktaGFyaS1saWJ1ci_SAQA?oc=5&hl=en-ID&gl=ID&ceid=ID:en,"Olahraga Otak, Anies Baswedan Ajak Putranya Tanding Catur di ... - KBA NEWS",,,KBA NEWS,"Olahraga Otak, Anies Baswedan Ajak Putranya Tanding Catur di ...  KBA NEWS","Sun, 08 Jan 2023 08:00:00 GMT"
Muhaimin Iskandar,https://news.google.com/rss/articles/CBMibWh0dHBzOi8vd3d3LmFudGFyYW5ld3MuY29tL2Jlcml0YS8zMzM5NzAyL2tyaW1pbmFsLWtlbWFyaW4tYXJ0LWRpLWNpcGF5dW5nLXRld2FzLWhpbmdnYS1rYXN1cy1tdXRpbGFzaS1iZWthc2nSAW9odHRwczovL20uYW50YXJhbmV3cy5jb20vYW1wL2Jlcml0YS8zMzM5NzAyL2tyaW1pbmFsLWtlbWFyaW4tYXJ0LWRpLWNpcGF5dW5nLXRld2FzLWhpbmdnYS1rYXN1cy1tdXRpbGFzaS1iZWthc2k?oc=5&hl=en-ID&gl=ID&ceid=ID:en,"Kriminal kemarin, ART di Cipayung tewas hingga kasus mutilasi Bekasi - ANTARA",,,ANTARA,"Kriminal kemarin, ART di Cipayung tewas hingga kasus mutilasi Bekasi  ANTARA","Sat, 07 Jan 2023 08:00:00 GMT"
Muhaimin Iskandar,https://news.google.com/rss/articles/CBMidWh0dHBzOi8vbmFzaW9uYWwudGVtcG8uY28vcmVhZC8xNjc2MDY4L2RpdG8tbWFoZW5kcmEtZGlwYW5nZ2lsLWtway10ZXJrYWl0LWthc3VzLXBlbmN1Y2lhbi11YW5nLXNla3JldGFyaXMtbWEtbnVyaGFkadIBdGh0dHBzOi8vbmFzaW9uYWwudGVtcG8uY28vYW1wLzE2NzYwNjgvZGl0by1tYWhlbmRyYS1kaXBhbmdnaWwta3BrLXRlcmthaXQta2FzdXMtcGVuY3VjaWFuLXVhbmctc2VrcmV0YXJpcy1tYS1udXJoYWRp?oc=5&hl=en-ID&gl=ID&ceid=ID:en,Dito Mahendra Dipanggil KPK Terkait Kasus Pencucian Uang Sekretaris MA Nurhadi - Nasional Tempo,,,Nasional Tempo,Dito Mahendra Dipanggil KPK Terkait Kasus Pencucian Uang Sekretaris MA Nurhadi  Nasional Tempo,"Thu, 05 Jan 2023 08:00:00 GMT"
Muhaimin Iskandar,https://news.google.com/rss/articles/CBMiWWh0dHBzOi8va2JhbmV3cy5jb20vcGlsaWhhbi1yZWRha3NpL2hvYWtzLWFuaWVzLXBlcm5haC1tZW5pa2FoLXNpcmktZGVuZ2FuLWRoZW5hLWRldmFua2Ev0gEA?oc=5&hl=en-ID&gl=ID&ceid=ID:en,Hoaks! Anies Pernah Menikah Siri dengan Dhena Devanka - KBA ... - KBA NEWS,,,KBA NEWS,Hoaks! Anies Pernah Menikah Siri dengan Dhena Devanka - KBA ...  KBA NEWS,"Thu, 05 Jan 2023 08:00:00 GMT"
