keyword,url,title,content,author,publisher,description,publish_date
Muhaimin Iskandar,https://news.google.com/rss/articles/CBMiZ2h0dHBzOi8vd3d3LmFudGFyYW5ld3MuY29tL2Jlcml0YS8zMzUyNDEzL3Jha29ybmFzLWtlcGFsYS1kYWVyYWgtc2UtaW5kb25lc2lhLWJhaGFzLWVrb25vbWktZGFuLWluZmxhc2nSAWlodHRwczovL20uYW50YXJhbmV3cy5jb20vYW1wL2Jlcml0YS8zMzUyNDEzL3Jha29ybmFzLWtlcGFsYS1kYWVyYWgtc2UtaW5kb25lc2lhLWJhaGFzLWVrb25vbWktZGFuLWluZmxhc2k?oc=5&hl=en-ID&gl=ID&ceid=ID:en,Rakornas Kepala Daerah se-Indonesia bahas ekonomi dan inflasi - ANTARA,,,ANTARA,Rakornas Kepala Daerah se-Indonesia bahas ekonomi dan inflasi  ANTARA,"Tue, 17 Jan 2023 08:00:00 GMT"
Muhaimin Iskandar,https://news.google.com/rss/articles/CBMiVGh0dHBzOi8va2JhbmV3cy5jb20vcGlsaWhhbi1yZWRha3NpL3JlbGF3YW4tYWJyaS0xLWRla2F0aS10b2tvaC1hZ2FtYS1tYWR1cmEtZGFuLW51L9IBAA?oc=5&hl=en-ID&gl=ID&ceid=ID:en,Relawan ABRI-1 Dekati Tokoh Agama Madura dan NU - KBA NEWS - KBA NEWS,,,KBA NEWS,Relawan ABRI-1 Dekati Tokoh Agama Madura dan NU - KBA NEWS  KBA NEWS,"Tue, 17 Jan 2023 08:00:00 GMT"
Muhaimin Iskandar,https://news.google.com/rss/articles/CBMibWh0dHBzOi8vd3d3LmFudGFyYW5ld3MuY29tL2Jlcml0YS8zMzUyNzM0L2pha3NhLW55YXRha2FuLXRhay1hZGEtYWxhc2FuLXVudHVrLW1lcmluZ2Fua2FuLWh1a3VtYW4tZmVyZHktc2FtYm_SAW9odHRwczovL20uYW50YXJhbmV3cy5jb20vYW1wL2Jlcml0YS8zMzUyNzM0L2pha3NhLW55YXRha2FuLXRhay1hZGEtYWxhc2FuLXVudHVrLW1lcmluZ2Fua2FuLWh1a3VtYW4tZmVyZHktc2FtYm8?oc=5&hl=en-ID&gl=ID&ceid=ID:en,Jaksa nyatakan tak ada alasan untuk meringankan hukuman Ferdy Sambo - ANTARA,,,ANTARA,Jaksa nyatakan tak ada alasan untuk meringankan hukuman Ferdy Sambo  ANTARA,"Tue, 17 Jan 2023 08:00:00 GMT"
Muhaimin Iskandar,https://news.google.com/rss/articles/CBMiXWh0dHBzOi8va2JhbmV3cy5jb20vZ2VsaWF0LWRhZXJhaC9tb2JpbC1icmFuZGluZy1hbmllcy1iYXN3ZWRhbi1iZXJ0ZWJhcmFuLWRpLXBlbG9zb2stbmVnZXJpL9IBAA?oc=5&hl=en-ID&gl=ID&ceid=ID:en,Mobil Branding Anies Baswedan Bertebaran di Pelosok Negeri ... - KBA NEWS,,,KBA NEWS,Mobil Branding Anies Baswedan Bertebaran di Pelosok Negeri ...  KBA NEWS,"Mon, 16 Jan 2023 08:00:00 GMT"
Muhaimin Iskandar,https://news.google.com/rss/articles/CBMijAFodHRwczovL25hc2lvbmFsLnRlbXBvLmNvL3JlYWQvMTY4MDkyOS95ZW5ueS13YWhpZC1kaXNhbmRpbmctc2FuZGluZ2thbi1kZW5nYW4tYW5pZXMtYmFzd2VkYW4tdW50dWstcGlscHJlcy0yMDI0LWJlZ2luaS1wcm9maWwtcHV0cmktZ3VzLWR1ctIBiwFodHRwczovL25hc2lvbmFsLnRlbXBvLmNvL2FtcC8xNjgwOTI5L3llbm55LXdhaGlkLWRpc2FuZGluZy1zYW5kaW5na2FuLWRlbmdhbi1hbmllcy1iYXN3ZWRhbi11bnR1ay1waWxwcmVzLTIwMjQtYmVnaW5pLXByb2ZpbC1wdXRyaS1ndXMtZHVy?oc=5&hl=en-ID&gl=ID&ceid=ID:en,"Yenny Wahid Disanding-sandingkan dengan Anies Baswedan untuk Pilpres 2024, Begini Profil Putri Gus Dur - Nasional Tempo",,,Nasional Tempo,"Yenny Wahid Disanding-sandingkan dengan Anies Baswedan untuk Pilpres 2024, Begini Profil Putri Gus Dur  Nasional Tempo","Wed, 18 Jan 2023 08:00:00 GMT"
Muhaimin Iskandar,https://news.google.com/rss/articles/CBMiVWh0dHBzOi8vd3d3Lm5nb3BpYmFyZW5nLmlkL3JlYWQvaXN0YW5hLWJhZ2ktb3Jhbmctb3JhbmctcGVtYWFmLWluaS1qYW5qaS1hbGxhaC10YS1hbGHSAVlodHRwczovL3d3dy5uZ29waWJhcmVuZy5pZC9yZWFkL2lzdGFuYS1iYWdpLW9yYW5nLW9yYW5nLXBlbWFhZi1pbmktamFuamktYWxsYWgtdGEtYWxhL2FtcA?oc=5&hl=en-ID&gl=ID&ceid=ID:en,"Istana bagi Orang-orang Pemaaf, Ini Janji Allah Ta'ala - ngopibareng.id",,,ngopibareng.id,"Istana bagi Orang-orang Pemaaf, Ini Janji Allah Ta'ala  ngopibareng.id","Tue, 17 Jan 2023 08:00:00 GMT"
Muhaimin Iskandar,https://news.google.com/rss/articles/CBMibGh0dHBzOi8vd3d3LmFudGFyYW5ld3MuY29tL2Jlcml0YS8zMzU3NzA4L3NlaGF0cS1nYW5kZW5nLXJzLWJyYXdpamF5YS1ycy1odXNhZGEtcGVybHVhcy1qYXJpbmdhbi1sYXlhbmFuLWIyYtIBbmh0dHBzOi8vbS5hbnRhcmFuZXdzLmNvbS9hbXAvYmVyaXRhLzMzNTc3MDgvc2VoYXRxLWdhbmRlbmctcnMtYnJhd2lqYXlhLXJzLWh1c2FkYS1wZXJsdWFzLWphcmluZ2FuLWxheWFuYW4tYjJi?oc=5&hl=en-ID&gl=ID&ceid=ID:en,SehatQ gandeng RS Brawijaya & RS Husada perluas jaringan layanan B2B - ANTARA,,,ANTARA,SehatQ gandeng RS Brawijaya & RS Husada perluas jaringan layanan B2B  ANTARA,"Fri, 20 Jan 2023 08:00:00 GMT"
Muhaimin Iskandar,https://news.google.com/rss/articles/CBMibGh0dHBzOi8va2JhbmV3cy5jb20vcGlsaWhhbi1yZWRha3NpL2t1bmp1bmdpLXdpc2F0YS1ydW1wdW4tYmFtYnUtdHViYW4tZGFwYXQtYW5nZ290YS1yZWxhd2FuLWFuaWVzLWJhc3dlZGFuL9IBAA?oc=5&hl=en-ID&gl=ID&ceid=ID:en,"Kunjungi Wisata Rumpun Bambu Tuban, Dapat Anggota Relawan ... - KBA NEWS",,,KBA NEWS,"Kunjungi Wisata Rumpun Bambu Tuban, Dapat Anggota Relawan ...  KBA NEWS","Fri, 20 Jan 2023 08:00:00 GMT"
Muhaimin Iskandar,https://news.google.com/rss/articles/CBMiemh0dHBzOi8vbmFzaW9uYWwudGVtcG8uY28vcmVhZC8xNjgyMjgwL3BhcnRhaS11bW1hdC1ueWF0YWthbi1zaWFwLWhhZGFwaS1wZW1pbHUtMjAyNC1zZWthbGlwdW4tcGFrYWktcHJvcG9yc2lvbmFsLXRlcnR1dHVw0gF5aHR0cHM6Ly9uYXNpb25hbC50ZW1wby5jby9hbXAvMTY4MjI4MC9wYXJ0YWktdW1tYXQtbnlhdGFrYW4tc2lhcC1oYWRhcGktcGVtaWx1LTIwMjQtc2VrYWxpcHVuLXBha2FpLXByb3BvcnNpb25hbC10ZXJ0dXR1cA?oc=5&hl=en-ID&gl=ID&ceid=ID:en,"Partai Ummat Nyatakan Siap Hadapi Pemilu 2024, Sekalipun Pakai Proporsional Tertutup - Nasional Tempo",,,Nasional Tempo,"Partai Ummat Nyatakan Siap Hadapi Pemilu 2024, Sekalipun Pakai Proporsional Tertutup  Nasional Tempo","Sat, 21 Jan 2023 08:00:00 GMT"
Muhaimin Iskandar,https://news.google.com/rss/articles/CBMiW2h0dHBzOi8va2JhbmV3cy5jb20vaG90LW5ld3MvY3VjdS11bGFtYS1iZXNhci1wZW5kaXJpLXBlcnRpLWJlcnRla2FkLWR1a3VuZy1hbmllcy1iYXN3ZWRhbi_SAQA?oc=5&hl=en-ID&gl=ID&ceid=ID:en,Cucu Ulama Besar Pendiri Perti Bertekad Dukung Anies Baswedan ... - KBA NEWS,,,KBA NEWS,Cucu Ulama Besar Pendiri Perti Bertekad Dukung Anies Baswedan ...  KBA NEWS,"Mon, 16 Jan 2023 08:00:00 GMT"
Muhaimin Iskandar,https://news.google.com/rss/articles/CBMiSGh0dHBzOi8va2JhbmV3cy5jb20vc2VuZ2dhbmcvcmFtYWktcGFudHVuLXRlbnRhbmctYW5pZXMtZGktbWVkaWEtc29zaWFsL9IBAA?oc=5&hl=en-ID&gl=ID&ceid=ID:en,Ramai Pantun tentang Anies di Media Sosial - KBA NEWS - KBA NEWS,,,KBA NEWS,Ramai Pantun tentang Anies di Media Sosial - KBA NEWS  KBA NEWS,"Fri, 20 Jan 2023 08:00:00 GMT"
Muhaimin Iskandar,https://news.google.com/rss/articles/CBMiVGh0dHBzOi8va2JhbmV3cy5jb20vaG90LW5ld3MvcmVsYXdhbi1hZnBpLWRpbWludGEtbWVuamFsYW5rYW4tYW1hbmFoLWFuaWVzLWJhc3dlZGFuL9IBAA?oc=5&hl=en-ID&gl=ID&ceid=ID:en,Relawan AFPI Diminta Menjalankan Amanah Anies Baswedan ... - KBA NEWS,,,KBA NEWS,Relawan AFPI Diminta Menjalankan Amanah Anies Baswedan ...  KBA NEWS,"Fri, 20 Jan 2023 08:00:00 GMT"
Muhaimin Iskandar,https://news.google.com/rss/articles/CBMiYmh0dHBzOi8vd3d3LmFudGFyYW5ld3MuY29tL2Jlcml0YS8zMzU4NzA0L2tlbWVua2V1LXBlcmluZ2F0a2FuLW1hc3lhcmFrYXQtd2FzcGFkYWktcGVuaXB1YW4tbGVsYW5n0gFkaHR0cHM6Ly9tLmFudGFyYW5ld3MuY29tL2FtcC9iZXJpdGEvMzM1ODcwNC9rZW1lbmtldS1wZXJpbmdhdGthbi1tYXN5YXJha2F0LXdhc3BhZGFpLXBlbmlwdWFuLWxlbGFuZw?oc=5&hl=en-ID&gl=ID&ceid=ID:en,Kemenkeu peringatkan masyarakat waspadai penipuan lelang - ANTARA,,,ANTARA,Kemenkeu peringatkan masyarakat waspadai penipuan lelang  ANTARA,"Fri, 20 Jan 2023 08:00:00 GMT"
Muhaimin Iskandar,https://news.google.com/rss/articles/CBMib2h0dHBzOi8vd3d3LmFudGFyYW5ld3MuY29tL2Jlcml0YS8zMzU1MjkzL3VuaXZlcnNpdGFzLXByYXNldGl5YS1tdWx5YS1rb3JlYS1wb2x5dGNobmljLWRpcmlrYW4tcG9saXRla25pay1kaS1yadIBcWh0dHBzOi8vbS5hbnRhcmFuZXdzLmNvbS9hbXAvYmVyaXRhLzMzNTUyOTMvdW5pdmVyc2l0YXMtcHJhc2V0aXlhLW11bHlhLWtvcmVhLXBvbHl0Y2huaWMtZGlyaWthbi1wb2xpdGVrbmlrLWRpLXJp?oc=5&hl=en-ID&gl=ID&ceid=ID:en,Universitas Prasetiya Mulya-Korea Polytchnic dirikan politeknik di RI - ANTARA,,,ANTARA,Universitas Prasetiya Mulya-Korea Polytchnic dirikan politeknik di RI  ANTARA,"Wed, 18 Jan 2023 08:00:00 GMT"
Muhaimin Iskandar,https://news.google.com/rss/articles/CBMicGh0dHBzOi8vd3d3LmFudGFyYW5ld3MuY29tL2Jlcml0YS8zMzUxNDA1L3NlanVtbGFoLW5lZ2FyYS1hcmFiLW11bmdraW4tYWthbi10ZXJhcGthbi1iZWJhcy12aXNhLWJhZ2ktd2FyZ2EtcnVzaWHSAXJodHRwczovL20uYW50YXJhbmV3cy5jb20vYW1wL2Jlcml0YS8zMzUxNDA1L3NlanVtbGFoLW5lZ2FyYS1hcmFiLW11bmdraW4tYWthbi10ZXJhcGthbi1iZWJhcy12aXNhLWJhZ2ktd2FyZ2EtcnVzaWE?oc=5&hl=en-ID&gl=ID&ceid=ID:en,Sejumlah negara Arab mungkin akan terapkan bebas visa bagi warga Rusia - ANTARA,,,ANTARA,Sejumlah negara Arab mungkin akan terapkan bebas visa bagi warga Rusia  ANTARA,"Mon, 16 Jan 2023 08:00:00 GMT"
Muhaimin Iskandar,https://news.google.com/rss/articles/CBMiPGh0dHBzOi8va2JhbmV3cy5jb20vcmVzb25hbnNpL2RpY2FyaS1wcmVzaWRlbi1hbnRpLW9saWdhcmtpL9IBAA?oc=5&hl=en-ID&gl=ID&ceid=ID:en,Dicari Presiden Anti-Oligarki - KBA NEWS - KBA NEWS,,,KBA NEWS,Dicari Presiden Anti-Oligarki - KBA NEWS  KBA NEWS,"Mon, 16 Jan 2023 08:00:00 GMT"
Muhaimin Iskandar,https://news.google.com/rss/articles/CBMiXmh0dHBzOi8va2JhbmV3cy5jb20vaG90LW5ld3Mvc2FsZm9rLWthb3MtYW5pZXMtZHItcmVmbHkta2Fvcy15YW5nLWRpcGFrYWktYW5pZXMtbmFtcG9sLWJhbmdldC_SAQA?oc=5&hl=en-ID&gl=ID&ceid=ID:en,"Salfok Kaos Anies, Dr. Refly: Kaos yang Dipakai Anies Nampol ... - KBA NEWS",,,KBA NEWS,"Salfok Kaos Anies, Dr. Refly: Kaos yang Dipakai Anies Nampol ...  KBA NEWS","Mon, 23 Jan 2023 08:00:00 GMT"
Muhaimin Iskandar,https://news.google.com/rss/articles/CBMiXGh0dHBzOi8va2JhbmV3cy5jb20vc2VuZ2dhbmcvbWVtb3JpLWFuaWVzLWRpcGFuZ2dpbC1iai1oYWJpYmllLWRpd2FudGktd2FudGktaGFkYXBpLXJha3Nhc2Ev0gEA?oc=5&hl=en-ID&gl=ID&ceid=ID:en,"Memori Anies Dipanggil BJ Habibie, Diwanti-wanti Hadapi Raksasa ... - KBA NEWS",,,KBA NEWS,"Memori Anies Dipanggil BJ Habibie, Diwanti-wanti Hadapi Raksasa ...  KBA NEWS","Mon, 16 Jan 2023 08:00:00 GMT"
Muhaimin Iskandar,https://news.google.com/rss/articles/CBMibGh0dHBzOi8vd3d3LmFudGFyYW5ld3MuY29tL2Jlcml0YS8zMzU5NTAyL3RpbS1zYXItZ2FidW5nYW4tZXZha3Vhc2ktcGVudW1wYW5nLWthcGFsLXRlbmdnZWxhbS1kaS1sYWJ1YW4tYmFqb9IBbmh0dHBzOi8vbS5hbnRhcmFuZXdzLmNvbS9hbXAvYmVyaXRhLzMzNTk1MDIvdGltLXNhci1nYWJ1bmdhbi1ldmFrdWFzaS1wZW51bXBhbmcta2FwYWwtdGVuZ2dlbGFtLWRpLWxhYnVhbi1iYWpv?oc=5&hl=en-ID&gl=ID&ceid=ID:en,Tim SAR gabungan evakuasi penumpang kapal tenggelam di Labuan Bajo - ANTARA,,,ANTARA,Tim SAR gabungan evakuasi penumpang kapal tenggelam di Labuan Bajo  ANTARA,"Sat, 21 Jan 2023 08:00:00 GMT"
Muhaimin Iskandar,https://news.google.com/rss/articles/CBMihQFodHRwczovL2tiYW5ld3MuY29tL3BpbGloYW4tcmVkYWtzaS9hbmllcy1kaXNlYnV0LWJha2FsLWphZGktYm9uZWthLWFzLW1hbnRhbi1yZWt0b3ItaWJudS1jaGFsZHVuLXRlZ2Fza2FuLXByZXNpZGVuLWhhaS10ZWJhci1maXRuYWgv0gEA?oc=5&hl=en-ID&gl=ID&ceid=ID:en,"Anies Disebut Bakal Jadi Boneka AS, Mantan Rektor Ibnu Chaldun ... - KBA NEWS",,,KBA NEWS,"Anies Disebut Bakal Jadi Boneka AS, Mantan Rektor Ibnu Chaldun ...  KBA NEWS","Sat, 21 Jan 2023 08:00:00 GMT"
Muhaimin Iskandar,https://news.google.com/rss/articles/CBMihAFodHRwczovL2tiYW5ld3MuY29tL2dlbGlhdC1kYWVyYWgvZGloYWRpcmktYW5pZXMtcGVsYXdhay1hbnl1bi1jYWRlbC1hamFrLW1hc3lhcmFrYXQtaGFkaXJpLW5hc2RlbS15b3V0aC1mZXN0aXZhbC1kaS1zYWJ1Z2EtYmFuZHVuZy_SAQA?oc=5&hl=en-ID&gl=ID&ceid=ID:en,Pelawak Anyun Cadel Ajak Masyarakat Hadiri NasDem Youth ... - KBA NEWS,,,KBA NEWS,Pelawak Anyun Cadel Ajak Masyarakat Hadiri NasDem Youth ...  KBA NEWS,"Tue, 17 Jan 2023 08:00:00 GMT"
Muhaimin Iskandar,https://news.google.com/rss/articles/CBMib2h0dHBzOi8vd3d3LmFudGFyYW5ld3MuY29tL2Jlcml0YS8zMzU5MDQ2L3BlbWJhbmdraXQtdGVyYmFrYXItcGxuLXB1bGloa2FuLWtlcnVzYWthbi1saXN0cmlrLWRpLXNhYnUtcmFpanVhLW50dNIBcWh0dHBzOi8vbS5hbnRhcmFuZXdzLmNvbS9hbXAvYmVyaXRhLzMzNTkwNDYvcGVtYmFuZ2tpdC10ZXJiYWthci1wbG4tcHVsaWhrYW4ta2VydXNha2FuLWxpc3RyaWstZGktc2FidS1yYWlqdWEtbnR0?oc=5&hl=en-ID&gl=ID&ceid=ID:en,"Pembangkit terbakar, PLN pulihkan kerusakan listrik di Sabu Raijua-NTT - ANTARA",,,ANTARA,"Pembangkit terbakar, PLN pulihkan kerusakan listrik di Sabu Raijua-NTT  ANTARA","Sat, 21 Jan 2023 08:00:00 GMT"
Muhaimin Iskandar,https://news.google.com/rss/articles/CBMiVGh0dHBzOi8vd3d3LmFudGFyYW5ld3MuY29tL2ZvdG8vMzM1ODcyMi93aXNhdGEtZ3JhdGlzLWRlbmdhbi1idXMtd2lzYXRhLXRyYW5zamFrYXJ0YdIBAA?oc=5&hl=en-ID&gl=ID&ceid=ID:en,Wisata gratis dengan Bus Wisata Transjakarta - Foto ANTARA News - ANTARA,,,ANTARA,Wisata gratis dengan Bus Wisata Transjakarta - Foto ANTARA News  ANTARA,"Fri, 20 Jan 2023 08:00:00 GMT"
Muhaimin Iskandar,https://news.google.com/rss/articles/CBMia2h0dHBzOi8va2JhbmV3cy5jb20vZ2VsaWF0LWRhZXJhaC9tYW50YXAtcmVsYXdhbi1hbmllcy1kaS1rZXB1bGF1YW4tcmlhdS1iYWthbC1kaXJpa2FuLXNla3JldGFyaWF0LWJlcnNhbWEv0gEA?oc=5&hl=en-ID&gl=ID&ceid=ID:en,Mantap! Relawan Anies di Kepulauan Riau Bakal Dirikan ... - KBA NEWS,,,KBA NEWS,Mantap! Relawan Anies di Kepulauan Riau Bakal Dirikan ...  KBA NEWS,"Mon, 16 Jan 2023 08:00:00 GMT"
Muhaimin Iskandar,https://news.google.com/rss/articles/CBMiZmh0dHBzOi8vcmlhdXBvcy5qYXdhcG9zLmNvbS9yaWF1LzE3LzAxLzIwMjMvMjkyNDcyL2tvbXBhay1kYW4taGVib2gtbWVuZ2dhdW5na2FuLXN1YXJhLWRpLXRyaWJ1bmUuaHRtbNIBZmh0dHBzOi8vcmlhdXBvcy5qYXdhcG9zLmNvbS9yaWF1LzE3LzAxLzIwMjMvMjkyNDcyL2tvbXBhay1kYW4taGVib2gtbWVuZ2dhdW5na2FuLXN1YXJhLWRpLXRyaWJ1bmUvYW1wLw?oc=5&hl=en-ID&gl=ID&ceid=ID:en,Kompak dan Heboh Menggaungkan Suara di Tribune - RiauPos,,,RiauPos,Kompak dan Heboh Menggaungkan Suara di Tribune  RiauPos,"Tue, 17 Jan 2023 08:00:00 GMT"
Muhaimin Iskandar,https://news.google.com/rss/articles/CBMiWGh0dHBzOi8vd3d3LmJhbGlwb3N0LmNvbS9uZXdzLzIwMjMvMDEvMjAvMzE4MDQyL0tlcGVtaW1waW5hbi1kYXJpLVBlcnNwZWt0aWYtV2F5YW5nLmh0bWzSAQA?oc=5&hl=en-ID&gl=ID&ceid=ID:en,Kepemimpinan dari Perspektif Wayang | BALIPOST.com - BALIPOST.com,,,BALIPOST.com,Kepemimpinan dari Perspektif Wayang | BALIPOST.com  BALIPOST.com,"Fri, 20 Jan 2023 08:00:00 GMT"
Muhaimin Iskandar,https://news.google.com/rss/articles/CBMicGh0dHBzOi8va2JhbmV3cy5jb20vZ2VsaWF0LWRhZXJhaC9wZW5ndXJ1cy1kcHAtZHB3LWRhbi1kcGQtYWxpbnNhbi1tZXJpYWhrYW4tamFsYW4tc2VoYXQtYmVyc2FtYS1hbmllcy1iYXN3ZWRhbi_SAQA?oc=5&hl=en-ID&gl=ID&ceid=ID:en,"Pengurus DPP, DPW, dan DPD ALINSAN Meriahkan Jalan Sehat ... - KBA NEWS",,,KBA NEWS,"Pengurus DPP, DPW, dan DPD ALINSAN Meriahkan Jalan Sehat ...  KBA NEWS","Sun, 22 Jan 2023 08:00:00 GMT"
Muhaimin Iskandar,https://news.google.com/rss/articles/CBMiXWh0dHBzOi8vYmlzbmlzLnRlbXBvLmNvL3JlYWQvMTY4MTA4My9pbmlsYWgtNC1rb25nbG9tZXJhdC1wZW1pbGlrLWthbXB1cy10ZXJuYW1hLWRpLWluZG9uZXNpYdIBXGh0dHBzOi8vYmlzbmlzLnRlbXBvLmNvL2FtcC8xNjgxMDgzL2luaWxhaC00LWtvbmdsb21lcmF0LXBlbWlsaWsta2FtcHVzLXRlcm5hbWEtZGktaW5kb25lc2lh?oc=5&hl=en-ID&gl=ID&ceid=ID:en,Inilah 4 Konglomerat Pemilik Kampus Ternama di Indonesia - Bisnis Tempo.co,,,Bisnis Tempo.co,Inilah 4 Konglomerat Pemilik Kampus Ternama di Indonesia  Bisnis Tempo.co,"Wed, 18 Jan 2023 08:00:00 GMT"
Muhaimin Iskandar,https://news.google.com/rss/articles/CBMiY2h0dHBzOi8vbWVnYXBvbGl0YW4uYW50YXJhbmV3cy5jb20vYmVyaXRhLzIyNzUyMC9yZWt0b3ItaXBiLXVuaXZlcnNpdHktYXJpZi1zYXRyaWEtZGlsYW50aWsta2VtYmFsadIBZ2h0dHBzOi8vbWVnYXBvbGl0YW4uYW50YXJhbmV3cy5jb20vYW1wL2Jlcml0YS8yMjc1MjAvcmVrdG9yLWlwYi11bml2ZXJzaXR5LWFyaWYtc2F0cmlhLWRpbGFudGlrLWtlbWJhbGk?oc=5&hl=en-ID&gl=ID&ceid=ID:en,Rektor IPB University Arif Satria dilantik kembali - ANTARA Megapolitan,,,ANTARA Megapolitan,Rektor IPB University Arif Satria dilantik kembali  ANTARA Megapolitan,"Wed, 18 Jan 2023 08:00:00 GMT"
Muhaimin Iskandar,https://news.google.com/rss/articles/CBMicWh0dHBzOi8vcmlhdXBvcy5qYXdhcG9zLmNvbS9yaWF1LzE3LzAxLzIwMjMvMjkyNTE5L2phZGktcGFydG5lci1iaXNuaXMtc3RyYXRlZ2lzLWJyaS10dW1idWgtYmVyc2FtYS1yaWF1LXBvcy5odG1s0gFxaHR0cHM6Ly9yaWF1cG9zLmphd2Fwb3MuY29tL3JpYXUvMTcvMDEvMjAyMy8yOTI1MTkvamFkaS1wYXJ0bmVyLWJpc25pcy1zdHJhdGVnaXMtYnJpLXR1bWJ1aC1iZXJzYW1hLXJpYXUtcG9zL2FtcC8?oc=5&hl=en-ID&gl=ID&ceid=ID:en,"Jadi Partner Bisnis Strategis, BRI Tumbuh Bersama Riau Pos - RiauPos",,,RiauPos,"Jadi Partner Bisnis Strategis, BRI Tumbuh Bersama Riau Pos  RiauPos","Tue, 17 Jan 2023 08:00:00 GMT"
Muhaimin Iskandar,https://news.google.com/rss/articles/CBMiX2h0dHBzOi8vbmFzaW9uYWwudGVtcG8uY28vcmVhZC8xNjgxNTcyL2FwYS10dWdhcy1kYW4td2V3ZW5hbmctcGFuaXRpYS1wZW11bmd1dGFuLXN1YXJhLWF0YXUtcHBz0gFeaHR0cHM6Ly9uYXNpb25hbC50ZW1wby5jby9hbXAvMTY4MTU3Mi9hcGEtdHVnYXMtZGFuLXdld2VuYW5nLXBhbml0aWEtcGVtdW5ndXRhbi1zdWFyYS1hdGF1LXBwcw?oc=5&hl=en-ID&gl=ID&ceid=ID:en,Apa Tugas dan Wewenang Panitia Pemungutan Suara atau PPS? - Nasional Tempo,,,Nasional Tempo,Apa Tugas dan Wewenang Panitia Pemungutan Suara atau PPS?  Nasional Tempo,"Thu, 19 Jan 2023 08:00:00 GMT"
Muhaimin Iskandar,https://news.google.com/rss/articles/CBMiZmh0dHBzOi8vd3d3Lmpwbm4uY29tL25ld3MvYmFtc29ldC1tZW55dWtzZXNrYW4tZm9vZC1lc3RhdGUtdGFuZ2d1bmctamF3YWItYmVyc2FtYS1idWthbi1oYW55YS1rZW1lbnRhbtIBaGh0dHBzOi8vbS5qcG5uLmNvbS9hbXAvbmV3cy9iYW1zb2V0LW1lbnl1a3Nlc2thbi1mb29kLWVzdGF0ZS10YW5nZ3VuZy1qYXdhYi1iZXJzYW1hLWJ1a2FuLWhhbnlhLWtlbWVudGFu?oc=5&hl=en-ID&gl=ID&ceid=ID:en,"Bamsoet: Menyukseskan Food Estate Tanggung Jawab Bersama, Bukan Hanya Kementan - JPNN.com",,,JPNN.com,"Bamsoet: Menyukseskan Food Estate Tanggung Jawab Bersama, Bukan Hanya Kementan  JPNN.com","Thu, 19 Jan 2023 08:00:00 GMT"
Muhaimin Iskandar,https://news.google.com/rss/articles/CBMicGh0dHBzOi8va2JhbmV3cy5jb20vaG90LW5ld3Mvc2FtcGFpLWRpdHVkdWgta2FkcnVuLXZhcmlhbi1rYXRvbGlrLWp1YmlyLWxhc2thci1hbWFuLWJlcnRla2FkLWhlbnRpa2FuLWFkdS1kb21iYS_SAQA?oc=5&hl=en-ID&gl=ID&ceid=ID:en,"Sampai Dituduh Kadrun Varian Katolik, Jubir Laskar AMAN ... - KBA NEWS",,,KBA NEWS,"Sampai Dituduh Kadrun Varian Katolik, Jubir Laskar AMAN ...  KBA NEWS","Wed, 18 Jan 2023 08:00:00 GMT"
Muhaimin Iskandar,https://news.google.com/rss/articles/CBMib2h0dHBzOi8va2JhbmV3cy5jb20vZ2VsaWF0LWRhZXJhaC9kZW1pLWFuaWVzLXRpbS1sYXNrYXItYW1hbi1zZWJlcmFuZ2ktYW50YXJwdWxhdS1oaW5nZ2EtbWVtYmVsYWgtcHVsYXUtZGktbnR0L9IBAA?oc=5&hl=en-ID&gl=ID&ceid=ID:en,"Demi Anies, Tim Laskar AMAN Seberangi Antarpulau hingga ... - KBA NEWS",,,KBA NEWS,"Demi Anies, Tim Laskar AMAN Seberangi Antarpulau hingga ...  KBA NEWS","Sat, 21 Jan 2023 08:00:00 GMT"
Muhaimin Iskandar,https://news.google.com/rss/articles/CBMidmh0dHBzOi8vbWVnYXBvbGl0YW4uYW50YXJhbmV3cy5jb20vYmVyaXRhLzIyNzQ1MS9hbHVuLWFsdW4tc3ViYW5nLXNlZ2VyYS1kaXJlbm92YXNpLWRlbmdhbi1hbmdnYXJhbi1zZWtpdGFyLXJwMi1taWxpYXLSAXpodHRwczovL21lZ2Fwb2xpdGFuLmFudGFyYW5ld3MuY29tL2FtcC9iZXJpdGEvMjI3NDUxL2FsdW4tYWx1bi1zdWJhbmctc2VnZXJhLWRpcmVub3Zhc2ktZGVuZ2FuLWFuZ2dhcmFuLXNla2l0YXItcnAyLW1pbGlhcg?oc=5&hl=en-ID&gl=ID&ceid=ID:en,Alun-alun Subang segera direnovasi dengan anggaran sekitar Rp2 miliar - ANTARA Megapolitan,,,ANTARA Megapolitan,Alun-alun Subang segera direnovasi dengan anggaran sekitar Rp2 miliar  ANTARA Megapolitan,"Tue, 17 Jan 2023 08:00:00 GMT"
Muhaimin Iskandar,https://news.google.com/rss/articles/CBMiX2h0dHBzOi8vd3d3Lmpwbm4uY29tL25ld3MvYWhzYW5oZW5kcmEtYmViZXItYmlhbmcta2Vyb2sta2FuZGFzLWRpLWJhYmFrLXBlcnRhbWEtaW5kaWEtb3Blbi0yMDIz0gFhaHR0cHM6Ly9tLmpwbm4uY29tL2FtcC9uZXdzL2Foc2FuaGVuZHJhLWJlYmVyLWJpYW5nLWtlcm9rLWthbmRhcy1kaS1iYWJhay1wZXJ0YW1hLWluZGlhLW9wZW4tMjAyMw?oc=5&hl=en-ID&gl=ID&ceid=ID:en,Ahsan/Hendra Beber Biang Kerok Kandas di Babak Pertama India Open 2023 - JPNN.com,,,JPNN.com,Ahsan/Hendra Beber Biang Kerok Kandas di Babak Pertama India Open 2023  JPNN.com,"Thu, 19 Jan 2023 08:00:00 GMT"
Muhaimin Iskandar,https://news.google.com/rss/articles/CBMigAFodHRwczovL25hc2lvbmFsLnRlbXBvLmNvL3JlYWQvMTY4MDQ5Mi9qb2tvd2kta3JpdGlrLWxhcmFuZ2FuLXBlbmRpcmlhbi1ydW1haC1pYmFkYWgta29uc3RpdHVzaS10YWstYm9sZWgta2FsYWgtb2xlaC1rZXNlcGFrYXRhbtIBf2h0dHBzOi8vbmFzaW9uYWwudGVtcG8uY28vYW1wLzE2ODA0OTIvam9rb3dpLWtyaXRpay1sYXJhbmdhbi1wZW5kaXJpYW4tcnVtYWgtaWJhZGFoLWtvbnN0aXR1c2ktdGFrLWJvbGVoLWthbGFoLW9sZWgta2VzZXBha2F0YW4?oc=5&hl=en-ID&gl=ID&ceid=ID:en,Jokowi Kritik Larangan Pendirian Rumah Ibadah: Konstitusi Tak Boleh Kalah oleh Kesepakatan - Nasional Tempo,,,Nasional Tempo,Jokowi Kritik Larangan Pendirian Rumah Ibadah: Konstitusi Tak Boleh Kalah oleh Kesepakatan  Nasional Tempo,"Tue, 17 Jan 2023 08:00:00 GMT"
Muhaimin Iskandar,https://news.google.com/rss/articles/CBMihQFodHRwczovL21ldHJvLnRlbXBvLmNvL3JlYWQvMTY4MDQyMi90b3AtMy1tZXRyby1oZXJ1LWJ1ZGktZGlzZWJ1dC1iZXJhbmktbGFuanV0a2FuLXByb2dyYW0tbWFuZGVrLWRpLWVyYS1hbmllcy1wb2xlbWlrLWphbGFuLWJlcmJheWFy0gGEAWh0dHBzOi8vbWV0cm8udGVtcG8uY28vYW1wLzE2ODA0MjIvdG9wLTMtbWV0cm8taGVydS1idWRpLWRpc2VidXQtYmVyYW5pLWxhbmp1dGthbi1wcm9ncmFtLW1hbmRlay1kaS1lcmEtYW5pZXMtcG9sZW1pay1qYWxhbi1iZXJiYXlhcg?oc=5&hl=en-ID&gl=ID&ceid=ID:en,"Top 3 Metro: Heru Budi Disebut Berani Lanjutkan Program Mandek di Era Anies, Polemik Jalan Berbayar - Metro Tempo",,,Metro Tempo,"Top 3 Metro: Heru Budi Disebut Berani Lanjutkan Program Mandek di Era Anies, Polemik Jalan Berbayar  Metro Tempo","Tue, 17 Jan 2023 08:00:00 GMT"
Muhaimin Iskandar,https://news.google.com/rss/articles/CBMieWh0dHBzOi8vYmlzbmlzLnRlbXBvLmNvL3JlYWQvMTY4MTA1Ny9tZW5wYXJla3JhZi1zYW5kaWFnYS11bm8tc2VidXQtaWJ1LWtvdGEtcGluZGFoLXRhay1wZW5nYXJ1aGktYmlzbmlzLWhvdGVsLWRpLWpha2FydGHSAXhodHRwczovL2Jpc25pcy50ZW1wby5jby9hbXAvMTY4MTA1Ny9tZW5wYXJla3JhZi1zYW5kaWFnYS11bm8tc2VidXQtaWJ1LWtvdGEtcGluZGFoLXRhay1wZW5nYXJ1aGktYmlzbmlzLWhvdGVsLWRpLWpha2FydGE?oc=5&hl=en-ID&gl=ID&ceid=ID:en,Menparekraf Sandiaga Uno Sebut Ibu Kota Pindah Tak Pengaruhi Bisnis Hotel di Jakarta - Bisnis Tempo.co,,,Bisnis Tempo.co,Menparekraf Sandiaga Uno Sebut Ibu Kota Pindah Tak Pengaruhi Bisnis Hotel di Jakarta  Bisnis Tempo.co,"Wed, 18 Jan 2023 08:00:00 GMT"
Muhaimin Iskandar,https://news.google.com/rss/articles/CBMiXWh0dHBzOi8vd3d3Lmpwbm4uY29tL25ld3MvcnVtYWgtZGluYXMta2Fwb2xkYS1wYXB1YS1sdWRlcy10ZXJiYWthci10ZXJkZW5nYXItdGVyaWFrYW4tbGVkYWthbtIBX2h0dHBzOi8vbS5qcG5uLmNvbS9hbXAvbmV3cy9ydW1haC1kaW5hcy1rYXBvbGRhLXBhcHVhLWx1ZGVzLXRlcmJha2FyLXRlcmRlbmdhci10ZXJpYWthbi1sZWRha2Fu?oc=5&hl=en-ID&gl=ID&ceid=ID:en,"Rumah Dinas Kapolda Papua Ludes Terbakar, Terdengar Teriakan & Ledakan - JPNN.com",,,JPNN.com,"Rumah Dinas Kapolda Papua Ludes Terbakar, Terdengar Teriakan & Ledakan  JPNN.com","Tue, 17 Jan 2023 08:00:00 GMT"
Muhaimin Iskandar,https://news.google.com/rss/articles/CBMiamh0dHBzOi8va2JhbmV3cy5jb20vZ2VsaWF0LWRhZXJhaC9kcHctamFybmFzLWFuaWVzLWJhc3dlZGFuLWphbWJpLWtpbmktcHVueWEtc2VrcmV0YXJpYXQtaW5pLWZhc2lsaXRhc255YS_SAQA?oc=5&hl=en-ID&gl=ID&ceid=ID:en,"DPW Jarnas Anies Baswedan Jambi Kini Punya Sekretariat, Ini ... - KBA NEWS",,,KBA NEWS,"DPW Jarnas Anies Baswedan Jambi Kini Punya Sekretariat, Ini ...  KBA NEWS","Thu, 19 Jan 2023 08:00:00 GMT"
Muhaimin Iskandar,https://news.google.com/rss/articles/CBMikwFodHRwczovL3d3dy50cmlidW5uZXdzLmNvbS9tYXRhLWxva2FsLW1lbWlsaWgvMjAyMy8wMS8xOC9ndW50dXItcm9tbGktaGluZ2dhLWFkZS1hcm1hbmRvLWRla2xhcmFzaS1nYW5qYXJpYW4tZHVrdW5nLWdhbmphci1wcmFub3dvLW1hanUtY2FwcmVzLTIwMjTSAZUBaHR0cHM6Ly9tLnRyaWJ1bm5ld3MuY29tL2FtcC9tYXRhLWxva2FsLW1lbWlsaWgvMjAyMy8wMS8xOC9ndW50dXItcm9tbGktaGluZ2dhLWFkZS1hcm1hbmRvLWRla2xhcmFzaS1nYW5qYXJpYW4tZHVrdW5nLWdhbmphci1wcmFub3dvLW1hanUtY2FwcmVzLTIwMjQ?oc=5&hl=en-ID&gl=ID&ceid=ID:en,"Guntur Romli Hingga Ade Armando Deklarasi Ganjarian, Dukung Ganjar Pranowo Maju Capres 2024 - Tribunnews.com",,,Tribunnews.com,"Guntur Romli Hingga Ade Armando Deklarasi Ganjarian, Dukung Ganjar Pranowo Maju Capres 2024  Tribunnews.com","Wed, 18 Jan 2023 08:00:00 GMT"
Muhaimin Iskandar,https://news.google.com/rss/articles/CBMid2h0dHBzOi8vcmlhdXBvcy5qYXdhcG9zLmNvbS9la29ub21pLWJpc25pcy8xOC8wMS8yMDIzLzI5MjU3MC9yYXlha2FuLWltbGVrLWJlcnNhbWEtZGVzeS1odWFuZy1kaS1ub3ZvdGVsLXBla2FuYmFydS5odG1s0gF3aHR0cHM6Ly9yaWF1cG9zLmphd2Fwb3MuY29tL2Vrb25vbWktYmlzbmlzLzE4LzAxLzIwMjMvMjkyNTcwL3JheWFrYW4taW1sZWstYmVyc2FtYS1kZXN5LWh1YW5nLWRpLW5vdm90ZWwtcGVrYW5iYXJ1L2FtcC8?oc=5&hl=en-ID&gl=ID&ceid=ID:en,Rayakan Imlek Bersama Desy Huang di Novotel Pekanbaru - RiauPos,,,RiauPos,Rayakan Imlek Bersama Desy Huang di Novotel Pekanbaru  RiauPos,"Wed, 18 Jan 2023 08:00:00 GMT"
Muhaimin Iskandar,https://news.google.com/rss/articles/CBMiU2h0dHBzOi8vYmlzbmlzLnRlbXBvLmNvL3JlYWQvMTY4MjYzMi9zYW5kaWFnYS11bm8tdW1rbS1nYWJ1bmcta29tdW5pdGFzLXN1cGF5YS1tYWp10gFSaHR0cHM6Ly9iaXNuaXMudGVtcG8uY28vYW1wLzE2ODI2MzIvc2FuZGlhZ2EtdW5vLXVta20tZ2FidW5nLWtvbXVuaXRhcy1zdXBheWEtbWFqdQ?oc=5&hl=en-ID&gl=ID&ceid=ID:en,Sandiaga Uno : UMKM Gabung Komunitas supaya Maju - Bisnis Tempo.co,,,Bisnis Tempo.co,Sandiaga Uno : UMKM Gabung Komunitas supaya Maju  Bisnis Tempo.co,"Sun, 22 Jan 2023 08:00:00 GMT"
Muhaimin Iskandar,https://news.google.com/rss/articles/CBMifGh0dHBzOi8vbmFzaW9uYWwua29tcGFzLmNvbS9yZWFkLzIwMjMvMDEvMzAvMTIyNDU4ODEvbXVoYWltaW4taXNrYW5kYXItaGFyYXAtcmVzaHVmZmxlLWthYmluZXQtdGluZ2thdGthbi1raW5lcmphLXBlbWVyaW50YWjSAYABaHR0cHM6Ly9hbXAua29tcGFzLmNvbS9uYXNpb25hbC9yZWFkLzIwMjMvMDEvMzAvMTIyNDU4ODEvbXVoYWltaW4taXNrYW5kYXItaGFyYXAtcmVzaHVmZmxlLWthYmluZXQtdGluZ2thdGthbi1raW5lcmphLXBlbWVyaW50YWg?oc=5&hl=en-ID&gl=ID&ceid=ID:en,"Muhaimin Iskandar Harap ""Reshuffle"" Kabinet Tingkatkan Kinerja Pemerintah, Bukan Hanya Politis - Kompas.com - Nasional Kompas.com",,,Nasional Kompas.com,"Muhaimin Iskandar Harap ""Reshuffle"" Kabinet Tingkatkan Kinerja Pemerintah, Bukan Hanya Politis - Kompas.com  Nasional Kompas.com","Mon, 30 Jan 2023 08:00:00 GMT"
Muhaimin Iskandar,https://news.google.com/rss/articles/CBMifmh0dHBzOi8vbmFzaW9uYWwua29tcGFzLmNvbS9yZWFkLzIwMjMvMDEvMjMvMTg1MjUxNDEvY2FrLWltaW4tYmVycG90ZW5zaS1qYWRpLWNhd2FwcmVzLXByYWJvd28tZ2VyaW5kcmEtaGFyYXBhbm55YS1zZXBlcnRpLWl0ddIBggFodHRwczovL2FtcC5rb21wYXMuY29tL25hc2lvbmFsL3JlYWQvMjAyMy8wMS8yMy8xODUyNTE0MS9jYWstaW1pbi1iZXJwb3RlbnNpLWphZGktY2F3YXByZXMtcHJhYm93by1nZXJpbmRyYS1oYXJhcGFubnlhLXNlcGVydGktaXR1?oc=5&hl=en-ID&gl=ID&ceid=ID:en,"Cak Imin Berpotensi Jadi Cawapres Prabowo, Gerindra: Harapannya Seperti Itu... - Kompas.com - Nasional Kompas.com",,,Nasional Kompas.com,"Cak Imin Berpotensi Jadi Cawapres Prabowo, Gerindra: Harapannya Seperti Itu... - Kompas.com  Nasional Kompas.com","Mon, 23 Jan 2023 08:00:00 GMT"
Muhaimin Iskandar,https://news.google.com/rss/articles/CBMiYGh0dHBzOi8vbmV3cy5yZXB1Ymxpa2EuY28uaWQvYmVyaXRhL3JwYTlxODQzNi9tdWhhaW1pbi1udS13YXRhay1kYXNhcm55YS1hZGFsYWgta2VrdWF0YW4tcG9saXRpa9IBAA?oc=5&hl=en-ID&gl=ID&ceid=ID:en,Muhaimin: NU Watak Dasarnya Adalah Kekuatan Politik | Republika ... - Republika Online,,,Republika Online,Muhaimin: NU Watak Dasarnya Adalah Kekuatan Politik | Republika ...  Republika Online,"Mon, 30 Jan 2023 08:00:00 GMT"
Muhaimin Iskandar,https://news.google.com/rss/articles/CBMiXGh0dHBzOi8vd3d3Lmpwbm4uY29tL25ld3MvZ3VzLW11aGFpbWluLWluZ2F0a2FuLXBlbnRpbmdueWEtbXV0dS1kYW4ta3VhbGl0YXMtcGVuZGFtcGluZy1kZXNh0gFeaHR0cHM6Ly9tLmpwbm4uY29tL2FtcC9uZXdzL2d1cy1tdWhhaW1pbi1pbmdhdGthbi1wZW50aW5nbnlhLW11dHUtZGFuLWt1YWxpdGFzLXBlbmRhbXBpbmctZGVzYQ?oc=5&hl=en-ID&gl=ID&ceid=ID:en,Gus Muhaimin Ingatkan Pentingnya Mutu dan Kualitas Pendamping Desa - JPNN.com,,,JPNN.com,Gus Muhaimin Ingatkan Pentingnya Mutu dan Kualitas Pendamping Desa  JPNN.com,"Fri, 27 Jan 2023 08:00:00 GMT"
