keyword,url,title,content,author,publisher,description,publish_date
Muhaimin Iskandar,https://news.google.com/rss/articles/CBMigQFodHRwczovL25hc2lvbmFsLmtvbXBhcy5jb20vcmVhZC8yMDIzLzAyLzA3LzE0MTQ1NDIxL2tvbmZsaWstZWxpdGUtcGtiLXBibnUtZGluaWxhaS1iaXNhLWdhbmdndS1zdGFiaWxpdGFzLWplbGFuZy1wZW1pbHU_cGFnZT1hbGzSAXxodHRwczovL2FtcC5rb21wYXMuY29tL25hc2lvbmFsL3JlYWQvMjAyMy8wMi8wNy8xNDE0NTQyMS9rb25mbGlrLWVsaXRlLXBrYi1wYm51LWRpbmlsYWktYmlzYS1nYW5nZ3Utc3RhYmlsaXRhcy1qZWxhbmctcGVtaWx1?oc=5&hl=en-ID&gl=ID&ceid=ID:en,Konflik Elite PKB-PBNU Dinilai Bisa Ganggu Stabilitas Jelang Pemilu - Kompas.com - Nasional Kompas.com,,,Nasional Kompas.com,Konflik Elite PKB-PBNU Dinilai Bisa Ganggu Stabilitas Jelang Pemilu - Kompas.com  Nasional Kompas.com,"Tue, 07 Feb 2023 08:00:00 GMT"
Muhaimin Iskandar,https://news.google.com/rss/articles/CBMidWh0dHBzOi8vbmFzaW9uYWwudGVtcG8uY28vcmVhZC8xNjg4MzI0L3NvYWwtY2FwcmVzLWNhd2FwcmVzLWdlcmluZHJhLXBhay1tdWhhaW1pbi1wYWxpbmcta3VhdC1qYWRpLXBlbmRhbXBpbmctcHJhYm93b9IBdGh0dHBzOi8vbmFzaW9uYWwudGVtcG8uY28vYW1wLzE2ODgzMjQvc29hbC1jYXByZXMtY2F3YXByZXMtZ2VyaW5kcmEtcGFrLW11aGFpbWluLXBhbGluZy1rdWF0LWphZGktcGVuZGFtcGluZy1wcmFib3dv?oc=5&hl=en-ID&gl=ID&ceid=ID:en,"Soal Capres-Cawapres, Gerindra: Pak Muhaimin Paling Kuat Jadi Pendamping Prabowo - Nasional Tempo",,,Nasional Tempo,"Soal Capres-Cawapres, Gerindra: Pak Muhaimin Paling Kuat Jadi Pendamping Prabowo  Nasional Tempo","Mon, 06 Feb 2023 08:00:00 GMT"
Muhaimin Iskandar,https://news.google.com/rss/articles/CBMia2h0dHBzOi8vbmV3cy5kZXRpay5jb20vYmVyaXRhL2QtNjU1NjkyNS9jYWstaW1pbi1pbnN0cnVrc2lrYW4ta2FkZXItcGtiLXNhbGF0LWdhaWItdW50dWsta29yYmFuLWdlbXBhLXR1cmtp0gFvaHR0cHM6Ly9uZXdzLmRldGlrLmNvbS9iZXJpdGEvZC02NTU2OTI1L2Nhay1pbWluLWluc3RydWtzaWthbi1rYWRlci1wa2Itc2FsYXQtZ2FpYi11bnR1ay1rb3JiYW4tZ2VtcGEtdHVya2kvYW1w?oc=5&hl=en-ID&gl=ID&ceid=ID:en,Cak Imin Instruksikan Kader PKB Salat Gaib untuk Korban Gempa Turki - detikNews,,,detikNews,Cak Imin Instruksikan Kader PKB Salat Gaib untuk Korban Gempa Turki  detikNews,"Tue, 07 Feb 2023 08:00:00 GMT"
Muhaimin Iskandar,https://news.google.com/rss/articles/CBMiYmh0dHBzOi8vcG9saXRpay5ybW9sLmlkL3JlYWQvMjAyMy8wMi8xMC81NjMyNDEvY2FrLWltaW4tZGFuLWFpcmxhbmdnYS1oYXJ0YXJ0by1jYXBhaS1rYXRhLXNlcGFrYXQt0gEA?oc=5&hl=en-ID&gl=ID&ceid=ID:en,Cak Imin dan Airlangga Hartarto Capai Kata Sepakat - Rmol.id,,,Rmol.id,Cak Imin dan Airlangga Hartarto Capai Kata Sepakat  Rmol.id,"Fri, 10 Feb 2023 08:00:00 GMT"
Muhaimin Iskandar,https://news.google.com/rss/articles/CBMiSWh0dHBzOi8vd3d3LmtvbXBhcy5pZC9iYWNhL3BvbGh1ay8yMDIzLzAyLzExL21lbWJ1cnUtc3VhcmEta2F1bS1uYWhkbGl5aW7SAQA?oc=5&hl=en-ID&gl=ID&ceid=ID:en,Memburu Suara Kaum Nahdliyin - kompas.id,,,kompas.id,Memburu Suara Kaum Nahdliyin  kompas.id,"Sun, 12 Feb 2023 08:00:00 GMT"
Muhaimin Iskandar,https://news.google.com/rss/articles/CBMidmh0dHBzOi8vbmFzaW9uYWwudGVtcG8uY28vcmVhZC8xNjg4MjI3L2ZhZGxpLXpvbi1idWthLXN1YXJhLXNvYWwtcGVyamFuamlhbi1hbmllcy1iYXN3ZWRhbi1zYW5kaWFnYS11bm8tZGktcGlsa2FkYS1ka2nSAXVodHRwczovL25hc2lvbmFsLnRlbXBvLmNvL2FtcC8xNjg4MjI3L2ZhZGxpLXpvbi1idWthLXN1YXJhLXNvYWwtcGVyamFuamlhbi1hbmllcy1iYXN3ZWRhbi1zYW5kaWFnYS11bm8tZGktcGlsa2FkYS1ka2k?oc=5&hl=en-ID&gl=ID&ceid=ID:en,Fadli Zon Buka Suara Soal Perjanjian Anies Baswedan - Sandiaga Uno di Pilkada DKI - Nasional Tempo,,,Nasional Tempo,Fadli Zon Buka Suara Soal Perjanjian Anies Baswedan - Sandiaga Uno di Pilkada DKI  Nasional Tempo,"Mon, 06 Feb 2023 08:00:00 GMT"
Muhaimin Iskandar,https://news.google.com/rss/articles/CBMicGh0dHBzOi8va2JhbmV3cy5jb20vaG90LW5ld3Mvc2VsYWluLW5hc2RlbS1wa3MtZGFuLWRlbW9rcmF0LXBlbmRldGEtc3VwaXQteWFraW4tcGFydGFpLWxhaW4tc2VnZXJhLWR1a3VuZy1hbmllcy_SAQA?oc=5&hl=en-ID&gl=ID&ceid=ID:en,"Selain NasDem, PKS dan Demokrat, Pendeta Supit Yakin Partai ... - KBA NEWS",,,KBA NEWS,"Selain NasDem, PKS dan Demokrat, Pendeta Supit Yakin Partai ...  KBA NEWS","Sat, 11 Feb 2023 08:00:00 GMT"
Muhaimin Iskandar,https://news.google.com/rss/articles/CBMiU2h0dHBzOi8vd3d3LmFudGFyYW5ld3MuY29tL2luZm9ncmFmaWsvMzM5MjUzMi9tZW5hbmdrYWwtZGlzaW5mb3JtYXNpLXNlcHV0YXItcGVtaWx10gEA?oc=5&hl=en-ID&gl=ID&ceid=ID:en,Menangkal disinformasi seputar pemilu - Infografik ANTARA News ... - ANTARA,,,ANTARA,Menangkal disinformasi seputar pemilu - Infografik ANTARA News ...  ANTARA,"Mon, 13 Feb 2023 08:00:00 GMT"
Muhaimin Iskandar,https://news.google.com/rss/articles/CBMicGh0dHBzOi8vd3d3LmRldGlrLmNvbS9qYXRlbmcvYmVyaXRhL2QtNjU1ODMzMi9oYXNpbC1tdXNyYS1qYXRlbmctZ2FuamFyLXVuZ2d1bC10aXBpcy1kYXJpLXByYWJvd28tc2ViYWdhaS1jYXByZXPSAXRodHRwczovL3d3dy5kZXRpay5jb20vamF0ZW5nL2Jlcml0YS9kLTY1NTgzMzIvaGFzaWwtbXVzcmEtamF0ZW5nLWdhbmphci11bmdndWwtdGlwaXMtZGFyaS1wcmFib3dvLXNlYmFnYWktY2FwcmVzL2FtcA?oc=5&hl=en-ID&gl=ID&ceid=ID:en,"Hasil Musra Jateng, Ganjar Unggul Tipis dari Prabowo sebagai Capres - detikJateng",,,detikJateng,"Hasil Musra Jateng, Ganjar Unggul Tipis dari Prabowo sebagai Capres  detikJateng","Wed, 08 Feb 2023 08:00:00 GMT"
Muhaimin Iskandar,https://news.google.com/rss/articles/CBMifWh0dHBzOi8vbmFzaW9uYWwua29tcGFzLmNvbS9yZWFkLzIwMjMvMDIvMTAvMTgyODAwMzEvbmFzZGVtLXR1ZGluZy1haXJsYW5nZ2EtaGFydGFydG8tZ29sa2FyLW1lbmFoYW4tZGlyaS1kdWt1bmctYW5pZXMtY2FwcmVz0gGBAWh0dHBzOi8vYW1wLmtvbXBhcy5jb20vbmFzaW9uYWwvcmVhZC8yMDIzLzAyLzEwLzE4MjgwMDMxL25hc2RlbS10dWRpbmctYWlybGFuZ2dhLWhhcnRhcnRvLWdvbGthci1tZW5haGFuLWRpcmktZHVrdW5nLWFuaWVzLWNhcHJlcw?oc=5&hl=en-ID&gl=ID&ceid=ID:en,"Nasdem Tuding Airlangga Hartarto Golkar ""Menahan Diri"" Dukung Anies Capres - Kompas.com - Nasional Kompas.com",,,Nasional Kompas.com,"Nasdem Tuding Airlangga Hartarto Golkar ""Menahan Diri"" Dukung Anies Capres - Kompas.com  Nasional Kompas.com","Fri, 10 Feb 2023 08:00:00 GMT"
Muhaimin Iskandar,https://news.google.com/rss/articles/CBMiYWh0dHBzOi8vamF0ZW5nLmFudGFyYW5ld3MuY29tL2Jlcml0YS80ODI1NDEvZHVhLWthZGVyLXBrYi1kaS1sZWdpc2xhdGlmLWtvdGEtYW1ib24tYWt0aXZpcy1nZXJlamHSAWVodHRwczovL2phdGVuZy5hbnRhcmFuZXdzLmNvbS9hbXAvYmVyaXRhLzQ4MjU0MS9kdWEta2FkZXItcGtiLWRpLWxlZ2lzbGF0aWYta290YS1hbWJvbi1ha3RpdmlzLWdlcmVqYQ?oc=5&hl=en-ID&gl=ID&ceid=ID:en,Dua kader PKB di legislatif Kota Ambon aktivis gereja - JATENG.ANTARANEWS.COM,,,JATENG.ANTARANEWS.COM,Dua kader PKB di legislatif Kota Ambon aktivis gereja  JATENG.ANTARANEWS.COM,"Mon, 13 Feb 2023 08:00:00 GMT"
Muhaimin Iskandar,https://news.google.com/rss/articles/CBMiT2h0dHBzOi8vdGlydG8uaWQvc2lhcGEtcGVuZGlyaS1wa2ItZGFmdGFyLWtldHVtLWRhbi1ub21vci11cnV0LXBlbWlsdS0yMDI0LWdCMzPSAVNodHRwczovL2FtcC50aXJ0by5pZC9zaWFwYS1wZW5kaXJpLXBrYi1kYWZ0YXIta2V0dW0tZGFuLW5vbW9yLXVydXQtcGVtaWx1LTIwMjQtZ0IzMw?oc=5&hl=en-ID&gl=ID&ceid=ID:en,"Siapa Pendiri PKB, Daftar Ketum, dan Nomor Urut Pemilu 2024 - Tirto.id",,,Tirto.id,"Siapa Pendiri PKB, Daftar Ketum, dan Nomor Urut Pemilu 2024  Tirto.id","Fri, 10 Feb 2023 08:00:00 GMT"
Muhaimin Iskandar,https://news.google.com/rss/articles/CBMidGh0dHBzOi8vbmFzaW9uYWwudGVtcG8uY28vcmVhZC8xNjkwMDUxL3N1cmF0LXV0YW5nLXBpdXRhbmctYW5pZXMtYmFzd2VkYW4tc2FuZGlhZ2EtdW5vLWJlcmVkYXItYWRhLTctcG9pbi1wZXJqYW5qaWFu0gFzaHR0cHM6Ly9uYXNpb25hbC50ZW1wby5jby9hbXAvMTY5MDA1MS9zdXJhdC11dGFuZy1waXV0YW5nLWFuaWVzLWJhc3dlZGFuLXNhbmRpYWdhLXVuby1iZXJlZGFyLWFkYS03LXBvaW4tcGVyamFuamlhbg?oc=5&hl=en-ID&gl=ID&ceid=ID:en,"Surat Utang Piutang Anies Baswedan - Sandiaga Uno Beredar, Ada 7 Poin Perjanjian - Nasional Tempo",,,Nasional Tempo,"Surat Utang Piutang Anies Baswedan - Sandiaga Uno Beredar, Ada 7 Poin Perjanjian  Nasional Tempo","Fri, 10 Feb 2023 08:00:00 GMT"
Muhaimin Iskandar,https://news.google.com/rss/articles/CBMiWWh0dHBzOi8vbmV3cy5kZXRpay5jb20vYmVyaXRhL2QtNjU1NTI5Mi9nZW1wYS1tLTUtMi1iYW50ZW4tdGVyYXNhLWRpLWpha2FydGEtaGluZ2dhLWJvZ29y0gFdaHR0cHM6Ly9uZXdzLmRldGlrLmNvbS9iZXJpdGEvZC02NTU1MjkyL2dlbXBhLW0tNS0yLWJhbnRlbi10ZXJhc2EtZGktamFrYXJ0YS1oaW5nZ2EtYm9nb3IvYW1w?oc=5&hl=en-ID&gl=ID&ceid=ID:en,"Gempa M 5,2 Banten Terasa di Jakarta hingga Bogor - detikNews",,,detikNews,"Gempa M 5,2 Banten Terasa di Jakarta hingga Bogor  detikNews","Tue, 07 Feb 2023 08:00:00 GMT"
Muhaimin Iskandar,https://news.google.com/rss/articles/CBMiaWh0dHBzOi8va2JhbmV3cy5jb20vZ2VsaWF0LWRhZXJhaC9kZWtsYXJhc2ktYW5pZXMtbmFzaW9uYWwta2FidXBhdGVuLW1lcmFuZ2luLWRpa2VtYXMtZGFsYW0tdGFibGlxLWFrYmFyL9IBAA?oc=5&hl=en-ID&gl=ID&ceid=ID:en,Deklarasi Anies Nasional Kabupaten Merangin Dikemas dalam ... - KBA NEWS,,,KBA NEWS,Deklarasi Anies Nasional Kabupaten Merangin Dikemas dalam ...  KBA NEWS,"Tue, 07 Feb 2023 08:00:00 GMT"
Muhaimin Iskandar,https://news.google.com/rss/articles/CBMiaWh0dHBzOi8va2JhbmV3cy5jb20vZ2VsaWF0LWRhZXJhaC9qYXJuYXMtbWlsZW5pYWwtbGFtcHVuZy1vcHRpbWlzdGlzLWdlbmVyYXNpLW11ZGEtZHVrdW5nLWFuaWVzLWJhc3dlZGFuL9IBAA?oc=5&hl=en-ID&gl=ID&ceid=ID:en,Jarnas Milenial Lampung Optimistis Generasi Muda Dukung Anies ... - KBA NEWS,,,KBA NEWS,Jarnas Milenial Lampung Optimistis Generasi Muda Dukung Anies ...  KBA NEWS,"Mon, 13 Feb 2023 08:00:00 GMT"
Muhaimin Iskandar,https://news.google.com/rss/articles/CBMiaWh0dHBzOi8va2JhbmV3cy5jb20vZ2VsaWF0LWRhZXJhaC9hdWxpYS1rb2Vkb2VzLXBlcmVtcHVhbi10YW5nZ3VoLXJlbGF3YW4tYW5pZXMtYmFzd2VkYW4taW5kb25lc2lhLXRpbXVyL9IBAA?oc=5&hl=en-ID&gl=ID&ceid=ID:en,"Aulia Koedoes, Perempuan Tangguh Relawan Anies Baswedan ... - KBA NEWS",,,KBA NEWS,"Aulia Koedoes, Perempuan Tangguh Relawan Anies Baswedan ...  KBA NEWS","Tue, 07 Feb 2023 08:00:00 GMT"
Muhaimin Iskandar,https://news.google.com/rss/articles/CBMibGh0dHBzOi8va2JhbmV3cy5jb20vZ2VsaWF0LWphdGltL2ZhaXJvdXotaHVkYS1rYWRlci1tdWRhLW51LWJhbnRhaC1hbmllcy1iYXN3ZWRhbi1tYWlua2FuLXBvbGl0aWstaWRlbnRpdGFzL9IBAA?oc=5&hl=en-ID&gl=ID&ceid=ID:en,Fairouz Huda Kader Muda NU Bantah Anies Baswedan Mainkan ... - KBA NEWS,,,KBA NEWS,Fairouz Huda Kader Muda NU Bantah Anies Baswedan Mainkan ...  KBA NEWS,"Wed, 08 Feb 2023 08:00:00 GMT"
Muhaimin Iskandar,https://news.google.com/rss/articles/CBMibWh0dHBzOi8va2JhbmV3cy5jb20vcGlsaWhhbi1yZWRha3NpL3JlbGF3YW4tc29iYXQtYW5pZXMtamF3YS10ZW5nYWgtc2VnZXJhLW1lbWJlbnR1ay1kcHctcGVyLWVrcy1rYXJlc2lkZW5hbi_SAQA?oc=5&hl=en-ID&gl=ID&ceid=ID:en,Relawan Sobat Anies Jawa Tengah Segera Membentuk DPW per ... - KBA NEWS,,,KBA NEWS,Relawan Sobat Anies Jawa Tengah Segera Membentuk DPW per ...  KBA NEWS,"Sun, 12 Feb 2023 08:00:00 GMT"
Muhaimin Iskandar,https://news.google.com/rss/articles/CBMidWh0dHBzOi8vd3d3LmRldGlrLmNvbS9qYXRpbS9iZXJpdGEvZC02NTU1MzE2L2p1dGFhbi1uYWhkbGl5aW4tdHVtcGxlay1ibGVrLWRpLWdvci1kZWx0YS10b2wtd2FydS1zaWRvYXJqby1tYWNldC1wYXJhaNIBeWh0dHBzOi8vd3d3LmRldGlrLmNvbS9qYXRpbS9iZXJpdGEvZC02NTU1MzE2L2p1dGFhbi1uYWhkbGl5aW4tdHVtcGxlay1ibGVrLWRpLWdvci1kZWx0YS10b2wtd2FydS1zaWRvYXJqby1tYWNldC1wYXJhaC9hbXA?oc=5&hl=en-ID&gl=ID&ceid=ID:en,"Jutaan Nahdliyin Tumplek Blek di GOR Delta, Tol Waru-Sidoarjo Macet Parah - detikJatim",,,detikJatim,"Jutaan Nahdliyin Tumplek Blek di GOR Delta, Tol Waru-Sidoarjo Macet Parah  detikJatim","Tue, 07 Feb 2023 08:00:00 GMT"
Muhaimin Iskandar,https://news.google.com/rss/articles/CBMiZWh0dHBzOi8vYXRqZWh3YXRjaC5jb20vMjAyMy8wMi8wNi9naWJyYW4tdG9sYWstdXN1bGFuLWd1YmVybnVyLWRpdHVuanVrLXByZXNpZGVuLWxlYmloLXNlcnUtbGFuZ3N1bmcv0gEA?oc=5&hl=en-ID&gl=ID&ceid=ID:en,Gibran Tolak Usulan Gubernur Ditunjuk Presiden: Lebih Seru ... - Atjeh Watch,,,Atjeh Watch,Gibran Tolak Usulan Gubernur Ditunjuk Presiden: Lebih Seru ...  Atjeh Watch,"Mon, 06 Feb 2023 08:00:00 GMT"
Muhaimin Iskandar,https://news.google.com/rss/articles/CBMiW2h0dHBzOi8va2JhbmV3cy5jb20vZ2VsaWF0LWphdGVuZy9yZWthbS1qZWphay1hbmllcy1iYXN3ZWRhbi15YW5nLWNlbWVybGFuZy1zdWxpdC1kaWJhbnRhaC_SAQA?oc=5&hl=en-ID&gl=ID&ceid=ID:en,Rekam Jejak Anies Baswedan yang Cemerlang Sulit Dibantah ... - KBA NEWS,,,KBA NEWS,Rekam Jejak Anies Baswedan yang Cemerlang Sulit Dibantah ...  KBA NEWS,"Thu, 09 Feb 2023 08:00:00 GMT"
Muhaimin Iskandar,https://news.google.com/rss/articles/CBMibWh0dHBzOi8vd3d3LmFudGFyYW5ld3MuY29tL2Jlcml0YS8zMzkxNTI0L3BldHVnYXMta29uc2VydmFzaS10YW1hbi1wZXNpc2lyLW5nYW1idXItYW1hbmthbi1wZW55dS15YW5nLXRlcmx1a2HSAW9odHRwczovL20uYW50YXJhbmV3cy5jb20vYW1wL2Jlcml0YS8zMzkxNTI0L3BldHVnYXMta29uc2VydmFzaS10YW1hbi1wZXNpc2lyLW5nYW1idXItYW1hbmthbi1wZW55dS15YW5nLXRlcmx1a2E?oc=5&hl=en-ID&gl=ID&ceid=ID:en,Petugas konservasi Taman Pesisir Ngambur amankan penyu yang terluka - ANTARA,,,ANTARA,Petugas konservasi Taman Pesisir Ngambur amankan penyu yang terluka  ANTARA,"Sat, 11 Feb 2023 08:00:00 GMT"
Muhaimin Iskandar,https://news.google.com/rss/articles/CBMiY2h0dHBzOi8va2JhbmV3cy5jb20vaG90LW5ld3Mvc3VkYWgtYmVyZGlyaS1kaS0yMC1wcm92aW5zaS1yZWxhd2FuLXJhbXBhcy1yaS0xLWJlb3JpZW50YXNpLXBhZGEtdHBzL9IBAA?oc=5&hl=en-ID&gl=ID&ceid=ID:en,"Sudah Berdiri di 20 Provinsi, Relawan Rampas RI 1 Beorientasi ... - KBA NEWS",,,KBA NEWS,"Sudah Berdiri di 20 Provinsi, Relawan Rampas RI 1 Beorientasi ...  KBA NEWS","Mon, 06 Feb 2023 08:00:00 GMT"
Muhaimin Iskandar,https://news.google.com/rss/articles/CBMif2h0dHBzOi8vbmFzaW9uYWwudGVtcG8uY28vcmVhZC8xNjg3NzYxL3Byb2ZpbC1zdWRpcm1hbi1zYWlkLWtldHVhLXRpbS1hbmllcy1iYXN3ZWRhbi1kaS1waWxwcmVzLTIwMjQtbWFudGFuLW1lbnRlcmktZXNkbS1qb2tvd2nSAX5odHRwczovL25hc2lvbmFsLnRlbXBvLmNvL2FtcC8xNjg3NzYxL3Byb2ZpbC1zdWRpcm1hbi1zYWlkLWtldHVhLXRpbS1hbmllcy1iYXN3ZWRhbi1kaS1waWxwcmVzLTIwMjQtbWFudGFuLW1lbnRlcmktZXNkbS1qb2tvd2k?oc=5&hl=en-ID&gl=ID&ceid=ID:en,"Profil Sudirman Said Ketua Tim Anies Baswedan di Pilpres 2024, Mantan Menteri ESDM Jokowi - Nasional Tempo",,,Nasional Tempo,"Profil Sudirman Said Ketua Tim Anies Baswedan di Pilpres 2024, Mantan Menteri ESDM Jokowi  Nasional Tempo","Sun, 05 Feb 2023 08:00:00 GMT"
Muhaimin Iskandar,https://news.google.com/rss/articles/CBMiggFodHRwczovL3d3dy52aXZhLmNvLmlkL2Jlcml0YS9wb2xpdGlrLzE1NzMxMjQtdHNyYy1wcmFib3dvLXN1YmlhbnRvLXBhbGluZy1ha3RpZi1rYW1wYW55ZS1kaS1mYWNlYm9vay1iaWF5YS1kaXRha3Npci1ycDEtNDctbWlsaWFy0gGGAWh0dHBzOi8vd3d3LnZpdmEuY28uaWQvYW1wL2Jlcml0YS9wb2xpdGlrLzE1NzMxMjQtdHNyYy1wcmFib3dvLXN1YmlhbnRvLXBhbGluZy1ha3RpZi1rYW1wYW55ZS1kaS1mYWNlYm9vay1iaWF5YS1kaXRha3Npci1ycDEtNDctbWlsaWFy?oc=5&hl=en-ID&gl=ID&ceid=ID:en,"TSRC: Prabowo Subianto Paling Aktif Kampanye di Facebook, Biaya Ditaksir Rp1,47 Miliar - VIVA.co.id",,,VIVA.co.id,"TSRC: Prabowo Subianto Paling Aktif Kampanye di Facebook, Biaya Ditaksir Rp1,47 Miliar  VIVA.co.id","Thu, 09 Feb 2023 08:00:00 GMT"
Muhaimin Iskandar,https://news.google.com/rss/articles/CBMiXmh0dHBzOi8va2JhbmV3cy5jb20vaG90LW5ld3MvZ3VzLW1haGFzaW4tYXByZXNpYXNpLWNhcmEtYW5pZXMtYmFzd2VkYW4tcGVyaW5nYXRpLXNhdHUtYWJhZC1udS_SAQA?oc=5&hl=en-ID&gl=ID&ceid=ID:en,Gus Mahasin Apresiasi Cara Anies Baswedan Peringati Satu Abad ... - KBA NEWS,,,KBA NEWS,Gus Mahasin Apresiasi Cara Anies Baswedan Peringati Satu Abad ...  KBA NEWS,"Fri, 10 Feb 2023 08:00:00 GMT"
Muhaimin Iskandar,https://news.google.com/rss/articles/CBMiamh0dHBzOi8va2JhbmV3cy5jb20vZ2VsaWF0LWRhZXJhaC9yZWxhd2FuLWFiY2x1Yi1iZXJ0ZWthZC1tZW5hbmdrYW4tYW5pZXMtZGFuLWtvYWxpc2ktcGVydWJhaGFuLWRpLXN1bHNlbC_SAQA?oc=5&hl=en-ID&gl=ID&ceid=ID:en,Relawan ABClub Bertekad Menangkan Anies dan Koalisi ... - KBA NEWS,,,KBA NEWS,Relawan ABClub Bertekad Menangkan Anies dan Koalisi ...  KBA NEWS,"Sat, 11 Feb 2023 08:00:00 GMT"
Muhaimin Iskandar,https://news.google.com/rss/articles/CBMiY2h0dHBzOi8vd3d3LmFudGFyYW5ld3MuY29tL2Jlcml0YS8zMzg1MDU5L2tlbWVua3VtaGFtLWhhbS1oYXJ1cy1iZXJkYW1waW5nYW4tZGVuZ2FuLWluc3RydW1lbi1odWt1bdIBZWh0dHBzOi8vbS5hbnRhcmFuZXdzLmNvbS9hbXAvYmVyaXRhLzMzODUwNTkva2VtZW5rdW1oYW0taGFtLWhhcnVzLWJlcmRhbXBpbmdhbi1kZW5nYW4taW5zdHJ1bWVuLWh1a3Vt?oc=5&hl=en-ID&gl=ID&ceid=ID:en,Kemenkumham: HAM harus berdampingan dengan instrumen hukum - ANTARA,,,ANTARA,Kemenkumham: HAM harus berdampingan dengan instrumen hukum  ANTARA,"Tue, 07 Feb 2023 08:00:00 GMT"
Muhaimin Iskandar,https://news.google.com/rss/articles/CBMia2h0dHBzOi8vbGFtcHVuZy5hbnRhcmFuZXdzLmNvbS9iZXJpdGEvNjczNjM1L3N1cnZlaS1sc2ktZGVubnktamEtc3VhcmEtcHNpLWRpcHJlZGlrc2ktZGktYXRhcy03LXBhcnBvbC1sYWlu0gFvaHR0cHM6Ly9sYW1wdW5nLmFudGFyYW5ld3MuY29tL2FtcC9iZXJpdGEvNjczNjM1L3N1cnZlaS1sc2ktZGVubnktamEtc3VhcmEtcHNpLWRpcHJlZGlrc2ktZGktYXRhcy03LXBhcnBvbC1sYWlu?oc=5&hl=en-ID&gl=ID&ceid=ID:en,Survei LSI Denny JA: Suara PSI diprediksi di atas 7 parpol lain - ANTARA Lampung,,,ANTARA Lampung,Survei LSI Denny JA: Suara PSI diprediksi di atas 7 parpol lain  ANTARA Lampung,"Tue, 07 Feb 2023 08:00:00 GMT"
Muhaimin Iskandar,https://news.google.com/rss/articles/CBMib2h0dHBzOi8vd3d3LmFudGFyYW5ld3MuY29tL2Jlcml0YS8zMzg4ODUxL2FqYWstaW5kdXN0cmkta2VyamFzYW1hLWZ0dWkta2VtYmFuZ2thbi1hbGF0LXVqaS1oYWxhbC1wcm9kdWstbWFrYW5hbtIBcWh0dHBzOi8vbS5hbnRhcmFuZXdzLmNvbS9hbXAvYmVyaXRhLzMzODg4NTEvYWphay1pbmR1c3RyaS1rZXJqYXNhbWEtZnR1aS1rZW1iYW5na2FuLWFsYXQtdWppLWhhbGFsLXByb2R1ay1tYWthbmFu?oc=5&hl=en-ID&gl=ID&ceid=ID:en,"Ajak industri kerjasama, FTUI kembangkan alat uji halal produk makanan - ANTARA",,,ANTARA,"Ajak industri kerjasama, FTUI kembangkan alat uji halal produk makanan  ANTARA","Thu, 09 Feb 2023 08:00:00 GMT"
Muhaimin Iskandar,https://news.google.com/rss/articles/CBMidWh0dHBzOi8va2JhbmV3cy5jb20vaG90LW5ld3Mvd2FyZ2Eta2F0b2xpay1zZWxhbWEtaW5pLXNheWEtc2VsYWx1LWRpdGFrdXQtdGFrdXRpLWluZm9ybWFzaS15YW5nLXNhbGFoLW1lbmdlbmFpLWFuaWVzL9IBAA?oc=5&hl=en-ID&gl=ID&ceid=ID:en,Warga Katolik: Selama Ini Saya Selalu Ditakut-takuti Informasi yang ... - KBA NEWS,,,KBA NEWS,Warga Katolik: Selama Ini Saya Selalu Ditakut-takuti Informasi yang ...  KBA NEWS,"Sat, 11 Feb 2023 08:00:00 GMT"
Muhaimin Iskandar,https://news.google.com/rss/articles/CBMic2h0dHBzOi8va2JhbmV3cy5jb20vZ2VsaWF0LWRhZXJhaC9rdWt1aGthbi1wZW5ndXJ1cy1kYWVyYWgta2VkYW4tYW5pZXMtYnVkaS1zYXJkaS1jcy1ha2FuLWtlbGlsaW5nLXN1bXV0LWJ1bGFuLWluaS_SAQA?oc=5&hl=en-ID&gl=ID&ceid=ID:en,"Kukuhkan Pengurus Daerah Kedan Anies, Budi Sardi Cs akan ... - KBA NEWS",,,KBA NEWS,"Kukuhkan Pengurus Daerah Kedan Anies, Budi Sardi Cs akan ...  KBA NEWS","Tue, 07 Feb 2023 08:00:00 GMT"
Muhaimin Iskandar,https://news.google.com/rss/articles/CBMibWh0dHBzOi8va2JhbmV3cy5jb20vcGlsaWhhbi1yZWRha3NpL2xhc2thci1hbWFuLWphd2EtdGVuZ2FoLXNpYXAtZHVsYW5nLXN1YXJhLWhldGVyb2dlbi11bnR1ay1hbmllcy1iYXN3ZWRhbi_SAQA?oc=5&hl=en-ID&gl=ID&ceid=ID:en,Laskar AMAN Jawa Tengah Siap Dulang Suara Heterogen untuk ... - KBA NEWS,,,KBA NEWS,Laskar AMAN Jawa Tengah Siap Dulang Suara Heterogen untuk ...  KBA NEWS,"Fri, 10 Feb 2023 08:00:00 GMT"
Muhaimin Iskandar,https://news.google.com/rss/articles/CBMigAFodHRwczovL25hc2lvbmFsLnRlbXBvLmNvL3JlYWQvMTY4ODI2NS9kZW1pLXByZXNpZGVudGlhbC10aHJlc2hvbGQtMjAtcGVyc2VuLTMta29hbGlzaS1wYXJ0YWktcG9saXRpay1wYW5hc2thbi1tZXNpbi1wZW1pbHUtMjAyNNIBf2h0dHBzOi8vbmFzaW9uYWwudGVtcG8uY28vYW1wLzE2ODgyNjUvZGVtaS1wcmVzaWRlbnRpYWwtdGhyZXNob2xkLTIwLXBlcnNlbi0zLWtvYWxpc2ktcGFydGFpLXBvbGl0aWstcGFuYXNrYW4tbWVzaW4tcGVtaWx1LTIwMjQ?oc=5&hl=en-ID&gl=ID&ceid=ID:en,"Demi Presidential Threshold 20 Persen, 3 Koalisi Partai Politik Panaskan Mesin Pemilu 2024 - Nasional Tempo",,,Nasional Tempo,"Demi Presidential Threshold 20 Persen, 3 Koalisi Partai Politik Panaskan Mesin Pemilu 2024  Nasional Tempo","Mon, 06 Feb 2023 08:00:00 GMT"
Muhaimin Iskandar,https://news.google.com/rss/articles/CBMibWh0dHBzOi8vd3d3LmFudGFyYW5ld3MuY29tL2Jlcml0YS8zMzg1MDk4L2tlbWVuZGlrYnVkcmlzdGVrLTE1MS1yaWJ1LXNhdHVhbi1pbXBsZW1lbnRhc2lrYW4ta3VyaWt1bHVtLW1lcmRla2HSAW9odHRwczovL20uYW50YXJhbmV3cy5jb20vYW1wL2Jlcml0YS8zMzg1MDk4L2tlbWVuZGlrYnVkcmlzdGVrLTE1MS1yaWJ1LXNhdHVhbi1pbXBsZW1lbnRhc2lrYW4ta3VyaWt1bHVtLW1lcmRla2E?oc=5&hl=en-ID&gl=ID&ceid=ID:en,Kemendikbudristek: 151 ribu satuan implementasikan Kurikulum Merdeka - ANTARA,,,ANTARA,Kemendikbudristek: 151 ribu satuan implementasikan Kurikulum Merdeka  ANTARA,"Tue, 07 Feb 2023 08:00:00 GMT"
Muhaimin Iskandar,https://news.google.com/rss/articles/CBMiYWh0dHBzOi8va2JhbmV3cy5jb20vc2VuZ2dhbmcvYW5pZXMtYmFzd2VkYW4tZGktbWF0YS10ZW1hbi1ha3RpdmlzLXVnbS1zZXRpYS1rYXdhbi1kYW4tbWVsaW5kdW5naS_SAQA?oc=5&hl=en-ID&gl=ID&ceid=ID:en,Anies Baswedan di Mata Teman Aktivis UGM: Setia Kawan dan ... - KBA NEWS,,,KBA NEWS,Anies Baswedan di Mata Teman Aktivis UGM: Setia Kawan dan ...  KBA NEWS,"Wed, 08 Feb 2023 08:00:00 GMT"
Muhaimin Iskandar,https://news.google.com/rss/articles/CBMiYGh0dHBzOi8va2JhbmV3cy5jb20vaG90LW5ld3Mvc2FsaW0taHV0YWp1bHUtYW5pZXMtaXR1LXBlcm1hdGEtc2VtYWtpbi1kaWdlc2VrLXNlbWFraW4tY2VtZXJsYW5nL9IBAA?oc=5&hl=en-ID&gl=ID&ceid=ID:en,Salim Hutajulu: Anies Itu Permata Semakin Digesek Semakin ... - KBA NEWS,,,KBA NEWS,Salim Hutajulu: Anies Itu Permata Semakin Digesek Semakin ...  KBA NEWS,"Thu, 09 Feb 2023 08:00:00 GMT"
Muhaimin Iskandar,https://news.google.com/rss/articles/CBMiO2h0dHBzOi8va2JhbmV3cy5jb20vcmVzb25hbnNpL2phdGVuZy1idWthbi1rYW5kYW5nLWJhbnRlbmcv0gEA?oc=5&hl=en-ID&gl=ID&ceid=ID:en,Jateng Bukan Kandang Banteng - KBA NEWS - KBA NEWS,,,KBA NEWS,Jateng Bukan Kandang Banteng - KBA NEWS  KBA NEWS,"Thu, 09 Feb 2023 08:00:00 GMT"
Muhaimin Iskandar,https://news.google.com/rss/articles/CBMifmh0dHBzOi8vam9nbG9zZW1hcm5ld3MuY29tLzIwMjMvMDIvcGlscHJlcy0yMDI0LWJha2FsLW11bmN1bC0zLXBhc2FuZ2FuLWdhbmphci1lcmljay1kaXByZWRpa3NpLWJha2FsLXBlcm9sZWgtc3VhcmEtdGVyYmFueWFrL9IBggFodHRwczovL2pvZ2xvc2VtYXJuZXdzLmNvbS8yMDIzLzAyL3BpbHByZXMtMjAyNC1iYWthbC1tdW5jdWwtMy1wYXNhbmdhbi1nYW5qYXItZXJpY2stZGlwcmVkaWtzaS1iYWthbC1wZXJvbGVoLXN1YXJhLXRlcmJhbnlhay9hbXAv?oc=5&hl=en-ID&gl=ID&ceid=ID:en,"Pilpres 2024 Bakal Muncul 3 Pasangan, Ganjar-Erick Diprediksi Bakal Peroleh Suara Terbanyak - JOGLOSEMAR NEWS",,,JOGLOSEMAR NEWS,"Pilpres 2024 Bakal Muncul 3 Pasangan, Ganjar-Erick Diprediksi Bakal Peroleh Suara Terbanyak  JOGLOSEMAR NEWS","Sun, 05 Feb 2023 08:00:00 GMT"
Muhaimin Iskandar,https://news.google.com/rss/articles/CBMibmh0dHBzOi8vd3d3LmFudGFyYW5ld3MuY29tL2Jlcml0YS8zMzg3ODg4L2RlZGktbXVseWFkaS1hdGFzaS1rZWtpc3J1aGFuLXdhcmdhLWRlbmdhbi1wZW5nZWxvbGEtcGFzYXItZGktc3ViYW5n0gFwaHR0cHM6Ly9tLmFudGFyYW5ld3MuY29tL2FtcC9iZXJpdGEvMzM4Nzg4OC9kZWRpLW11bHlhZGktYXRhc2kta2VraXNydWhhbi13YXJnYS1kZW5nYW4tcGVuZ2Vsb2xhLXBhc2FyLWRpLXN1YmFuZw?oc=5&hl=en-ID&gl=ID&ceid=ID:en,Dedi Mulyadi atasi kekisruhan warga dengan pengelola pasar di Subang - ANTARA,,,ANTARA,Dedi Mulyadi atasi kekisruhan warga dengan pengelola pasar di Subang  ANTARA,"Thu, 09 Feb 2023 08:00:00 GMT"
Muhaimin Iskandar,https://news.google.com/rss/articles/CBMiT2h0dHBzOi8va2JhbmV3cy5jb20vcmVzb25hbnNpL3ByYWJvd28tbnlhcHJlcy1zZXVtdXItaGlkdXAta2FwYW4tZ2lsaXJhbi1hbmllcy_SAQA?oc=5&hl=en-ID&gl=ID&ceid=ID:en,"Prabowo Nyapres Seumur Hidup, Kapan Giliran Anies? - KBA NEWS - KBA NEWS",,,KBA NEWS,"Prabowo Nyapres Seumur Hidup, Kapan Giliran Anies? - KBA NEWS  KBA NEWS","Tue, 07 Feb 2023 08:00:00 GMT"
Muhaimin Iskandar,https://news.google.com/rss/articles/CBMiaGh0dHBzOi8vd3d3LmFudGFyYW5ld3MuY29tL2Jlcml0YS8zMzg5NTc0L3ByZXNpZGVuLWNlay1oYXJnYS1zYW1iaWwtYmVsYW5qYS1kaS1wYXNhci1iYXR1cGhhdC10aW11ci1hY2Vo0gFqaHR0cHM6Ly9tLmFudGFyYW5ld3MuY29tL2FtcC9iZXJpdGEvMzM4OTU3NC9wcmVzaWRlbi1jZWstaGFyZ2Etc2FtYmlsLWJlbGFuamEtZGktcGFzYXItYmF0dXBoYXQtdGltdXItYWNlaA?oc=5&hl=en-ID&gl=ID&ceid=ID:en,Presiden cek harga sambil belanja di Pasar Batuphat Timur Aceh - ANTARA,,,ANTARA,Presiden cek harga sambil belanja di Pasar Batuphat Timur Aceh  ANTARA,"Fri, 10 Feb 2023 08:00:00 GMT"
Muhaimin Iskandar,https://news.google.com/rss/articles/CBMia2h0dHBzOi8va2JhbmV3cy5jb20vaG90LW5ld3Mva2FsYS1hbmllcy1oYXB1cy1rZWJpamFrYW4tbW90b3ItdGFrLWJvbGVoLWxld2F0LWphbGFuLXN1ZGlybWFuLWRlbWkta2VhZGlsYW4v0gEA?oc=5&hl=en-ID&gl=ID&ceid=ID:en,Kala Anies Hapus Kebijakan Motor Tak Boleh Lewat Jalan ... - KBA NEWS,,,KBA NEWS,Kala Anies Hapus Kebijakan Motor Tak Boleh Lewat Jalan ...  KBA NEWS,"Fri, 10 Feb 2023 08:00:00 GMT"
Muhaimin Iskandar,https://news.google.com/rss/articles/CBMiVGh0dHBzOi8vd3d3Lmpwbm4uY29tL25ld3MvaW5pbGFoLTQtcnV0ZS1wZW5lcmJhbmdhbi1iYXJ1LXlhbmctZGl1c3Vsa2FuLXBlbWthYi1rb2JhctIBVmh0dHBzOi8vbS5qcG5uLmNvbS9hbXAvbmV3cy9pbmlsYWgtNC1ydXRlLXBlbmVyYmFuZ2FuLWJhcnUteWFuZy1kaXVzdWxrYW4tcGVta2FiLWtvYmFy?oc=5&hl=en-ID&gl=ID&ceid=ID:en,Inilah 4 Rute Penerbangan Baru yang Diusulkan Pemkab Kobar - JPNN.com,,,JPNN.com,Inilah 4 Rute Penerbangan Baru yang Diusulkan Pemkab Kobar  JPNN.com,"Sat, 11 Feb 2023 08:00:00 GMT"
Muhaimin Iskandar,https://news.google.com/rss/articles/CBMiWWh0dHBzOi8vd3d3LmFudGFyYW5ld3MuY29tL2Jlcml0YS8zMzg4OTExL3B0LWJvZ29yLXJheWEtaG9ybWF0aS11cGF5YS1iYW5kaW5nLXNhdGdhcy1ibGJp0gFbaHR0cHM6Ly9tLmFudGFyYW5ld3MuY29tL2FtcC9iZXJpdGEvMzM4ODkxMS9wdC1ib2dvci1yYXlhLWhvcm1hdGktdXBheWEtYmFuZGluZy1zYXRnYXMtYmxiaQ?oc=5&hl=en-ID&gl=ID&ceid=ID:en,PT Bogor Raya hormati upaya banding Satgas BLBI - ANTARA,,,ANTARA,PT Bogor Raya hormati upaya banding Satgas BLBI  ANTARA,"Thu, 09 Feb 2023 08:00:00 GMT"
Muhaimin Iskandar,https://news.google.com/rss/articles/CBMiVWh0dHBzOi8vbmV3cy5kZXRpay5jb20vYmVyaXRhL2QtNjU1NTM4Mi9pY3ctYWRhLWtvbXBsb3Rhbi1kaS1iYWxpay1za2FuZGFsLXB1dHVzYW4tbWvSAVlodHRwczovL25ld3MuZGV0aWsuY29tL2Jlcml0YS9kLTY1NTUzODIvaWN3LWFkYS1rb21wbG90YW4tZGktYmFsaWstc2thbmRhbC1wdXR1c2FuLW1rL2FtcA?oc=5&hl=en-ID&gl=ID&ceid=ID:en,ICW: Ada Komplotan di Balik Skandal Putusan MK! - detikNews,,,detikNews,ICW: Ada Komplotan di Balik Skandal Putusan MK!  detikNews,"Tue, 07 Feb 2023 08:00:00 GMT"
Muhaimin Iskandar,https://news.google.com/rss/articles/CBMiUmh0dHBzOi8vd3d3LmFudGFyYW5ld3MuY29tL2ZvdG8vMzM4NTk2Mi9wZXJlc21pYW4tbGFwYW5nYW4tZ2FzLWphbWJhcmFuLXRpdW5nLWJpcnXSAQA?oc=5&hl=en-ID&gl=ID&ceid=ID:en,Peresmian lapangan gas Jambaran Tiung Biru - Foto ANTARA News - ANTARA,,,ANTARA,Peresmian lapangan gas Jambaran Tiung Biru - Foto ANTARA News  ANTARA,"Wed, 08 Feb 2023 08:00:00 GMT"
Muhaimin Iskandar,https://news.google.com/rss/articles/CBMicWh0dHBzOi8vd3d3LmthdGFudHQuY29tL2FydGlrZWwvNDY2MDYvLWphcmluZy1iYWNhbGVnLTUxLWthZGVyLXRlcmJhaWstcGtiLWtvdGEta3VwYW5nLWlrdXQtZml0LWFuZC1wcm9wZXItdGVzdC0v0gEA?oc=5&hl=en-ID&gl=ID&ceid=ID:en,"Jaring Bacaleg, 51 Kader Terbaik PKB Kota Kupang Ikut Fit and ... - katantt",,,katantt,"Jaring Bacaleg, 51 Kader Terbaik PKB Kota Kupang Ikut Fit and ...  katantt","Sun, 12 Feb 2023 08:00:00 GMT"
Muhaimin Iskandar,https://news.google.com/rss/articles/CBMidWh0dHBzOi8vbmFzaW9uYWwudGVtcG8uY28vcmVhZC8xNjkwMDMxL2J1cGF0aS1rYXJhbmdhbnlhci1qdWxpeWF0bW9uby1kaXR1bmp1ay1qYWRpLXBsdC1rZXR1YS1wYXJ0YWktZ29sa2FyLWtvdGEtc29sb9IBdGh0dHBzOi8vbmFzaW9uYWwudGVtcG8uY28vYW1wLzE2OTAwMzEvYnVwYXRpLWthcmFuZ2FueWFyLWp1bGl5YXRtb25vLWRpdHVuanVrLWphZGktcGx0LWtldHVhLXBhcnRhaS1nb2xrYXIta290YS1zb2xv?oc=5&hl=en-ID&gl=ID&ceid=ID:en,Bupati Karanganyar Juliyatmono Ditunjuk jadi Plt Ketua Partai Golkar Kota Solo - Nasional Tempo,,,Nasional Tempo,Bupati Karanganyar Juliyatmono Ditunjuk jadi Plt Ketua Partai Golkar Kota Solo  Nasional Tempo,"Fri, 10 Feb 2023 08:00:00 GMT"
