keyword,url,title,content,author,publisher,description,publish_date
Muhaimin Iskandar,https://news.google.com/rss/articles/CBMiWGh0dHBzOi8vbmFzaW9uYWwudGVtcG8uY28vcmVhZC8xNjk4ODQ4L3ByYWJvd28tc3ViaWFudG8tZ2FuZGVuZy1zdXJ5YS1wYWxvaC1kaS1oYW1iYWxhbmfSAVdodHRwczovL25hc2lvbmFsLnRlbXBvLmNvL2FtcC8xNjk4ODQ4L3ByYWJvd28tc3ViaWFudG8tZ2FuZGVuZy1zdXJ5YS1wYWxvaC1kaS1oYW1iYWxhbmc?oc=5&hl=en-ID&gl=ID&ceid=ID:en,Prabowo Subianto Gandeng Surya Paloh di Hambalang - Nasional Tempo,,,Nasional Tempo,Prabowo Subianto Gandeng Surya Paloh di Hambalang  Nasional Tempo,"Sun, 05 Mar 2023 08:00:00 GMT"
Muhaimin Iskandar,https://news.google.com/rss/articles/CBMie2h0dHBzOi8va2JhbmV3cy5jb20vZ2VsaWF0LWRhZXJhaC90ZW1idXMtMTA0LXNpbXB1bC1yZWxhd2FuLWJlcmFmaWxpYXNpLWtvcmVhbi1zZW1wYXQtZGljdXJpZ2FpLXBlcm9sZWgta3VjdXJhbi1kYW5hLWFzaW5nL9IBAA?oc=5&hl=en-ID&gl=ID&ceid=ID:en,"Tembus 104 Simpul Relawan Berafiliasi, KoReAn Sempat Dicurigai ... - KBA NEWS",,,KBA NEWS,"Tembus 104 Simpul Relawan Berafiliasi, KoReAn Sempat Dicurigai ...  KBA NEWS","Wed, 01 Mar 2023 08:00:00 GMT"
Muhaimin Iskandar,https://news.google.com/rss/articles/CBMibmh0dHBzOi8va2JhbmV3cy5jb20vaG90LW5ld3MvcHJvZmlsLWVnZ2ktc3VkamFuYS1ha3RpdmlzLXlhbmcta2luaS10ZXJhbmctdGVyYW5nYW4tZHVrdW5nLWFuaWVzLWphZGktcHJlc2lkZW4v0gEA?oc=5&hl=en-ID&gl=ID&ceid=ID:en,"Profil Eggi Sudjana, Aktivis yang Kini Terang-terangan Dukung ... - KBA NEWS",,,KBA NEWS,"Profil Eggi Sudjana, Aktivis yang Kini Terang-terangan Dukung ...  KBA NEWS","Tue, 28 Feb 2023 08:00:00 GMT"
Muhaimin Iskandar,https://news.google.com/rss/articles/CBMiPGh0dHBzOi8va2JhbmV3cy5jb20vcmVzb25hbnNpL3NpYXBhLWNhbG9uLWd1YmVybnVyLWRraS0yMDI0L9IBAA?oc=5&hl=en-ID&gl=ID&ceid=ID:en,Siapa Calon Gubernur DKI 2024? - KBA NEWS - KBA NEWS,,,KBA NEWS,Siapa Calon Gubernur DKI 2024? - KBA NEWS  KBA NEWS,"Thu, 02 Mar 2023 08:00:00 GMT"
Muhaimin Iskandar,https://news.google.com/rss/articles/CBMifWh0dHBzOi8vbmFzaW9uYWwudGVtcG8uY28vcmVhZC8xNjk3NTQ1L2FoeS1zYW1wYWlrYW4tc2FsYW0tZGFyaS1hbmllcy1iYXN3ZWRhbi1rZXBhZGEtd2FyZ2EtbWFtdWp1LWthbWktcHVueWEtYmFueWFrLWtlc2FtYWFu0gF8aHR0cHM6Ly9uYXNpb25hbC50ZW1wby5jby9hbXAvMTY5NzU0NS9haHktc2FtcGFpa2FuLXNhbGFtLWRhcmktYW5pZXMtYmFzd2VkYW4ta2VwYWRhLXdhcmdhLW1hbXVqdS1rYW1pLXB1bnlhLWJhbnlhay1rZXNhbWFhbg?oc=5&hl=en-ID&gl=ID&ceid=ID:en,AHY Sampaikan Salam dari Anies Baswedan kepada Warga Mamuju: Kami Punya Banyak Kesamaan - Nasional Tempo,,,Nasional Tempo,AHY Sampaikan Salam dari Anies Baswedan kepada Warga Mamuju: Kami Punya Banyak Kesamaan  Nasional Tempo,"Thu, 02 Mar 2023 08:00:00 GMT"
Muhaimin Iskandar,https://news.google.com/rss/articles/CBMidGh0dHBzOi8va2JhbmV3cy5jb20vcGlsaWhhbi1yZWRha3NpL3BhcnRhaS11bW1hdC1kaXktcGVyc2lsYWthbi1nZWR1bmctZHB3LXVudHVrLWtvbnNvbGlkYXNpLXJlbGF3YW4tYW5pZXMtYmFzd2VkYW4v0gEA?oc=5&hl=en-ID&gl=ID&ceid=ID:en,Partai Ummat DIY Persilakan Gedung DPW untuk Konsolidasi ... - KBA NEWS,,,KBA NEWS,Partai Ummat DIY Persilakan Gedung DPW untuk Konsolidasi ...  KBA NEWS,"Thu, 02 Mar 2023 08:00:00 GMT"
Muhaimin Iskandar,https://news.google.com/rss/articles/CBMiUGh0dHBzOi8va2JhbmV3cy5jb20vZ2VsaWF0LWRhZXJhaC9nZWdhcmEtYW5pZXMtc3VsdGFuLWJ1a2l0dGluZ2dpLWdhYnVuZy1uYXNkZW0v0gEA?oc=5&hl=en-ID&gl=ID&ceid=ID:en,"Gegara Anies, 'Sultan Bukittinggi' Gabung Nasdem - KBA NEWS - KBA NEWS",,,KBA NEWS,"Gegara Anies, 'Sultan Bukittinggi' Gabung Nasdem - KBA NEWS  KBA NEWS","Tue, 28 Feb 2023 08:00:00 GMT"
Muhaimin Iskandar,https://news.google.com/rss/articles/CBMiY2h0dHBzOi8va2JhbmV3cy5jb20vaG90LW5ld3MvcGtzLW5pbGFpLXBhbnRhcy1hbmllcy1iYXdhLXNsb2dhbi1iYXJ1LXBlbXByb3YtZGtpLXBhZGEtcGlscHJlcy0yMDI0L9IBAA?oc=5&hl=en-ID&gl=ID&ceid=ID:en,PKS Nilai Pantas Anies Bawa Slogan Baru Pemprov DKI pada ... - KBA NEWS,,,KBA NEWS,PKS Nilai Pantas Anies Bawa Slogan Baru Pemprov DKI pada ...  KBA NEWS,"Tue, 28 Feb 2023 08:00:00 GMT"
Muhaimin Iskandar,https://news.google.com/rss/articles/CBMiYmh0dHBzOi8va2JhbmV3cy5jb20vZ2VsaWF0LWRhZXJhaC9yZWxhd2FuLWFuaWVzLXAtMjQtamFiYXItZ2VuY2Fya2FuLWdlcmFrYW4tZHVrdW5nLWFuaWVzLW1lbmRlc2Ev0gEA?oc=5&hl=en-ID&gl=ID&ceid=ID:en,Relawan Anies P-24 Jabar Gencarkan Gerakan Dukung Anies ... - KBA NEWS,,,KBA NEWS,Relawan Anies P-24 Jabar Gencarkan Gerakan Dukung Anies ...  KBA NEWS,"Wed, 01 Mar 2023 08:00:00 GMT"
Muhaimin Iskandar,https://news.google.com/rss/articles/CBMifmh0dHBzOi8vbmFzaW9uYWwua29tcGFzLmNvbS9yZWFkLzIwMjMvMDIvMjgvMTUwMjE0NTEvc3VydmVpLW1lZGlhbi1lbGVrdGFiaWxpdGFzLXByYWJvd28tMjAtcGVyc2VuLWdhbmphci0xODktcGVyc2VuLWRhbi1hbmllc9IBggFodHRwczovL2FtcC5rb21wYXMuY29tL25hc2lvbmFsL3JlYWQvMjAyMy8wMi8yOC8xNTAyMTQ1MS9zdXJ2ZWktbWVkaWFuLWVsZWt0YWJpbGl0YXMtcHJhYm93by0yMC1wZXJzZW4tZ2FuamFyLTE4OS1wZXJzZW4tZGFuLWFuaWVz?oc=5&hl=en-ID&gl=ID&ceid=ID:en,"Survei Median: Elektabilitas Prabowo 20 Persen, Ganjar 18,9 Persen, dan Anies 17,9 Persen - Kompas.com - Nasional Kompas.com",,,Nasional Kompas.com,"Survei Median: Elektabilitas Prabowo 20 Persen, Ganjar 18,9 Persen, dan Anies 17,9 Persen - Kompas.com  Nasional Kompas.com","Tue, 28 Feb 2023 08:00:00 GMT"
Muhaimin Iskandar,https://news.google.com/rss/articles/CBMihQFodHRwczovL2tiYW5ld3MuY29tL2dlbGlhdC1kYWVyYWgvZHBjLWFuaWVzLXJlc21pLWRpYmVudHVrLWRpLXNlbHVydWgta2VjYW1hdGFuLXJlbGF3YW4tYmVydGVrYWQtamFkaWthbi10YW5nc2VsLWx1bWJ1bmctc3VhcmEtYW5pZXMv0gEA?oc=5&hl=en-ID&gl=ID&ceid=ID:en,"DPC ANIES Resmi Dibentuk di Seluruh Kecamatan, Relawan ... - KBA NEWS",,,KBA NEWS,"DPC ANIES Resmi Dibentuk di Seluruh Kecamatan, Relawan ...  KBA NEWS","Sun, 05 Mar 2023 08:00:00 GMT"
Muhaimin Iskandar,https://news.google.com/rss/articles/CBMiaGh0dHBzOi8vd3d3LmFudGFyYW5ld3MuY29tL2Jlcml0YS8zNDI2MTMyL2hlYmktbWFyYXB1LWthbnRvbmdpLWR1YS1nZWxhci11c2FpLWthbnZhc2thbi1wZXRpbmp1LXRoYWlsYW5k0gFqaHR0cHM6Ly9tLmFudGFyYW5ld3MuY29tL2FtcC9iZXJpdGEvMzQyNjEzMi9oZWJpLW1hcmFwdS1rYW50b25naS1kdWEtZ2VsYXItdXNhaS1rYW52YXNrYW4tcGV0aW5qdS10aGFpbGFuZA?oc=5&hl=en-ID&gl=ID&ceid=ID:en,Hebi Marapu kantongi dua gelar usai kanvaskan petinju Thailand - ANTARA,,,ANTARA,Hebi Marapu kantongi dua gelar usai kanvaskan petinju Thailand  ANTARA,"Sun, 05 Mar 2023 08:00:00 GMT"
Muhaimin Iskandar,https://news.google.com/rss/articles/CBMiZGh0dHBzOi8va2JhbmV3cy5jb20vaG90LW5ld3MvcGVuZ2FtYXQta2ViaWpha2FuLWFuaWVzLXB1bnlhLXJla2FtLWplamFrLW1lbGF3YW4tb2xpZ2Fya2ktZGktamFrYXJ0YS_SAQA?oc=5&hl=en-ID&gl=ID&ceid=ID:en,Pengamat Kebijakan: Anies Punya Rekam Jejak Melawan Oligarki ... - KBA NEWS,,,KBA NEWS,Pengamat Kebijakan: Anies Punya Rekam Jejak Melawan Oligarki ...  KBA NEWS,"Tue, 28 Feb 2023 08:00:00 GMT"
Muhaimin Iskandar,https://news.google.com/rss/articles/CBMiW2h0dHBzOi8vd3d3LmFudGFyYW5ld3MuY29tL2Jlcml0YS8zNDIxODkzL3Jza2QtbWFsdWt1LWtla3VyYW5nYW4tZG9rdGVyLXNwZXNpYWxpcy1haGxpLWppd2HSAV1odHRwczovL20uYW50YXJhbmV3cy5jb20vYW1wL2Jlcml0YS8zNDIxODkzL3Jza2QtbWFsdWt1LWtla3VyYW5nYW4tZG9rdGVyLXNwZXNpYWxpcy1haGxpLWppd2E?oc=5&hl=en-ID&gl=ID&ceid=ID:en,RSKD Maluku kekurangan dokter spesialis ahli jiwa - ANTARA,,,ANTARA,RSKD Maluku kekurangan dokter spesialis ahli jiwa  ANTARA,"Thu, 02 Mar 2023 08:00:00 GMT"
Muhaimin Iskandar,https://news.google.com/rss/articles/CBMibGh0dHBzOi8vd3d3LmFudGFyYW5ld3MuY29tL2Jlcml0YS8zNDE2OTQ5L2xvbWJvay1iYXJhdC1zdWtzZXMtZ2VsYXItbGFyaS1zdXN1ci1wYW50YWktZGlpa3V0aS1iZWxhc2FuLW5lZ2FyYdIBbmh0dHBzOi8vbS5hbnRhcmFuZXdzLmNvbS9hbXAvYmVyaXRhLzM0MTY5NDkvbG9tYm9rLWJhcmF0LXN1a3Nlcy1nZWxhci1sYXJpLXN1c3VyLXBhbnRhaS1kaWlrdXRpLWJlbGFzYW4tbmVnYXJh?oc=5&hl=en-ID&gl=ID&ceid=ID:en,Lombok Barat sukses gelar lari susur pantai diikuti belasan negara - ANTARA,,,ANTARA,Lombok Barat sukses gelar lari susur pantai diikuti belasan negara  ANTARA,"Mon, 27 Feb 2023 08:00:00 GMT"
Muhaimin Iskandar,https://news.google.com/rss/articles/CBMia2h0dHBzOi8vd3d3LmFudGFyYW5ld3MuY29tL2Jlcml0YS8zNDI0MjAwL2tlc2RtLW1pbnRhLWphZHdhbC1kYW4tamFsdXItdHJ1ay1iYXR1LWJhcmEtZGktamFtYmktbGViaWgtdGVydGli0gFtaHR0cHM6Ly9tLmFudGFyYW5ld3MuY29tL2FtcC9iZXJpdGEvMzQyNDIwMC9rZXNkbS1taW50YS1qYWR3YWwtZGFuLWphbHVyLXRydWstYmF0dS1iYXJhLWRpLWphbWJpLWxlYmloLXRlcnRpYg?oc=5&hl=en-ID&gl=ID&ceid=ID:en,KESDM minta jadwal dan jalur truk batu bara di Jambi lebih tertib - ANTARA,,,ANTARA,KESDM minta jadwal dan jalur truk batu bara di Jambi lebih tertib  ANTARA,"Fri, 03 Mar 2023 08:00:00 GMT"
Muhaimin Iskandar,https://news.google.com/rss/articles/CBMibmh0dHBzOi8vd3d3LmFudGFyYW5ld3MuY29tL2Jlcml0YS8zNDIxNjU5L2FuZ2dvdGEtZHByLXJvcm8tZXN0aS1yaS1iaXNhLW1hbmZhYXRrYW4tdGVrbm9sb2dpLWVidC1kYXJpLWh1bmdhcmlh0gFwaHR0cHM6Ly9tLmFudGFyYW5ld3MuY29tL2FtcC9iZXJpdGEvMzQyMTY1OS9hbmdnb3RhLWRwci1yb3JvLWVzdGktcmktYmlzYS1tYW5mYWF0a2FuLXRla25vbG9naS1lYnQtZGFyaS1odW5nYXJpYQ?oc=5&hl=en-ID&gl=ID&ceid=ID:en,Anggota DPR Roro Esti: RI bisa manfaatkan teknologi EBT dari Hungaria - ANTARA,,,ANTARA,Anggota DPR Roro Esti: RI bisa manfaatkan teknologi EBT dari Hungaria  ANTARA,"Thu, 02 Mar 2023 08:00:00 GMT"
Muhaimin Iskandar,https://news.google.com/rss/articles/CBMiY2h0dHBzOi8vd3d3LmFudGFyYW5ld3MuY29tL2Jlcml0YS8zNDI0MzU2L2JucGItYmVyaS1iYW50dWFuLXNwZWVkLXJlc2N1ZS1ib2F0LWtlcGFkYS1wZW1rYWItYW5hbWJhc9IBAA?oc=5&hl=en-ID&gl=ID&ceid=ID:en,"BNPB beri bantuan ""speed rescue boat"" kepada Pemkab Anambas - ANTARA",,,ANTARA,"BNPB beri bantuan ""speed rescue boat"" kepada Pemkab Anambas  ANTARA","Fri, 03 Mar 2023 08:00:00 GMT"
Muhaimin Iskandar,https://news.google.com/rss/articles/CBMicGh0dHBzOi8vd3d3LmFudGFyYW5ld3MuY29tL2Jlcml0YS8zNDI0MDc0L3BlcnRhbWluYS1zZWdlcmEtdGVyYXBrYW4tcXItY29kZS1wZW5naXNpYW4tc29sYXItYmVyc3Vic2lkaS1kaS1rYWx0aW3SAXJodHRwczovL20uYW50YXJhbmV3cy5jb20vYW1wL2Jlcml0YS8zNDI0MDc0L3BlcnRhbWluYS1zZWdlcmEtdGVyYXBrYW4tcXItY29kZS1wZW5naXNpYW4tc29sYXItYmVyc3Vic2lkaS1kaS1rYWx0aW0?oc=5&hl=en-ID&gl=ID&ceid=ID:en,Pertamina segera terapkan QR code pengisian solar bersubsidi di Kaltim - ANTARA,,,ANTARA,Pertamina segera terapkan QR code pengisian solar bersubsidi di Kaltim  ANTARA,"Fri, 03 Mar 2023 08:00:00 GMT"
Muhaimin Iskandar,https://news.google.com/rss/articles/CBMiXWh0dHBzOi8vd3d3LmFudGFyYW5ld3MuY29tL2Jlcml0YS8zNDIxNDcwL2RhdmlkLWRqYWphLXVuZ2thcC1hbGFzYW4tcGluZGFoLWtlLWtlbGFzLWl0Y3ItMTUwMNIBX2h0dHBzOi8vbS5hbnRhcmFuZXdzLmNvbS9hbXAvYmVyaXRhLzM0MjE0NzAvZGF2aWQtZGphamEtdW5na2FwLWFsYXNhbi1waW5kYWgta2Uta2VsYXMtaXRjci0xNTAw?oc=5&hl=en-ID&gl=ID&ceid=ID:en,David Djaja ungkap alasan pindah ke kelas ITCR 1.500 - ANTARA,,,ANTARA,David Djaja ungkap alasan pindah ke kelas ITCR 1.500  ANTARA,"Thu, 02 Mar 2023 08:00:00 GMT"
Muhaimin Iskandar,https://news.google.com/rss/articles/CBMic2h0dHBzOi8va2JhbmV3cy5jb20vcGlsaWhhbi1yZWRha3NpL3dhcmdhLTExLWRlc2EtZGkta2VjYW1hdGFuLWthbGl0ZW5nYWgtbGFtb25nYW4tc2lhcC1tZW1lbmFuZ2thbi1hbmllcy1iYXN3ZWRhbi_SAQA?oc=5&hl=en-ID&gl=ID&ceid=ID:en,Warga 11 Desa di Kecamatan Kalitengah Lamongan Siap ... - KBA NEWS,,,KBA NEWS,Warga 11 Desa di Kecamatan Kalitengah Lamongan Siap ...  KBA NEWS,"Mon, 27 Feb 2023 08:00:00 GMT"
Muhaimin Iskandar,https://news.google.com/rss/articles/CBMib2h0dHBzOi8va2JhbmV3cy5jb20vaG90LW5ld3MvdXN1bmctc2VtYW5nYXQta2ViYW5nc2Fhbi1sYXNrYXItYW1hbi1lZHVrYXNpLXB1Ymxpay1sZXdhdC1rYW5hbC15b3V0dWJlLWxhbWFuLXR2L9IBAA?oc=5&hl=en-ID&gl=ID&ceid=ID:en,"Usung Semangat Kebangsaan, Laskar AMAN Edukasi Publik lewat ... - KBA NEWS",,,KBA NEWS,"Usung Semangat Kebangsaan, Laskar AMAN Edukasi Publik lewat ...  KBA NEWS","Wed, 01 Mar 2023 08:00:00 GMT"
Muhaimin Iskandar,https://news.google.com/rss/articles/CBMiZWh0dHBzOi8va2JhbmV3cy5jb20vc2VuZ2dhbmcva2lzYWgtYXItYmFzd2VkYW4ta2FrZWstYW5pZXMtZGFuLWJ1bmcta2Fybm8tcGFkYS16YW1hbi1qZXBhbmctYmFnaWFuLTgv0gEA?oc=5&hl=en-ID&gl=ID&ceid=ID:en,Kisah AR Baswedan Kakek Anies dan Bung Karno pada Zaman ... - KBA NEWS,,,KBA NEWS,Kisah AR Baswedan Kakek Anies dan Bung Karno pada Zaman ...  KBA NEWS,"Mon, 27 Feb 2023 08:00:00 GMT"
Muhaimin Iskandar,https://news.google.com/rss/articles/CBMidGh0dHBzOi8va2JhbmV3cy5jb20vZ2VsaWF0LWRhZXJhaC9rZXR1bS1rb3JlYW4taW1iYXUtYmFyaXNhbi1yZWxhd2FuLWFuaWVzLWJhc3dlZGFuLXNvbGlkLXNvc2lhbGlzYXNpLWRhbi1rYXdhbC10cHMv0gEA?oc=5&hl=en-ID&gl=ID&ceid=ID:en,Ketum KoReAn Imbau Barisan Relawan Anies Baswedan Solid ... - KBA NEWS,,,KBA NEWS,Ketum KoReAn Imbau Barisan Relawan Anies Baswedan Solid ...  KBA NEWS,"Mon, 06 Mar 2023 08:00:00 GMT"
Muhaimin Iskandar,https://news.google.com/rss/articles/CBMibGh0dHBzOi8va2JhbmV3cy5jb20vaG90LW5ld3MvYmVnaW5pLWNhcmEtYW5pZXMtbWVuZ3VrdXIta2luZXJqYS1hbmFrLWJ1YWgtc2FhdC1tZW5qYWRpLWd1YmVybnVyLWRraS1qYWthcnRhL9IBAA?oc=5&hl=en-ID&gl=ID&ceid=ID:en,Begini Cara Anies Mengukur Kinerja Anak Buah saat Menjadi ... - KBA NEWS,,,KBA NEWS,Begini Cara Anies Mengukur Kinerja Anak Buah saat Menjadi ...  KBA NEWS,"Thu, 02 Mar 2023 08:00:00 GMT"
Muhaimin Iskandar,https://news.google.com/rss/articles/CBMia2h0dHBzOi8vd3d3LmFudGFyYW5ld3MuY29tL2Jlcml0YS8zNDIzMzY5L2phbGFuLWRpLXB1bGF1LXNpbWV1bHVlLWFjZWgtdGVydGltYnVuLWxvbmdzb3ItYWtpYmF0LWh1amFuLWRlcmFz0gFtaHR0cHM6Ly9tLmFudGFyYW5ld3MuY29tL2FtcC9iZXJpdGEvMzQyMzM2OS9qYWxhbi1kaS1wdWxhdS1zaW1ldWx1ZS1hY2VoLXRlcnRpbWJ1bi1sb25nc29yLWFraWJhdC1odWphbi1kZXJhcw?oc=5&hl=en-ID&gl=ID&ceid=ID:en,Jalan di Pulau Simeulue Aceh tertimbun longsor akibat hujan deras - ANTARA,,,ANTARA,Jalan di Pulau Simeulue Aceh tertimbun longsor akibat hujan deras  ANTARA,"Fri, 03 Mar 2023 08:00:00 GMT"
Muhaimin Iskandar,https://news.google.com/rss/articles/CBMiWWh0dHBzOi8vcG9saXRpay5ybW9sLmlkL3JlYWQvMjAyMy8wMy8wMi81NjUyOTYvbXVzaW0taHVqYW4tcGVtYmFuZ3VuYW4taWtuLWphZGktdGVyZ2FuZ2d10gEA?oc=5&hl=en-ID&gl=ID&ceid=ID:en,"Musim Hujan, Pembangunan IKN jadi Terganggu - Rmol.id",,,Rmol.id,"Musim Hujan, Pembangunan IKN jadi Terganggu  Rmol.id","Thu, 02 Mar 2023 08:00:00 GMT"
Muhaimin Iskandar,https://news.google.com/rss/articles/CBMiXGh0dHBzOi8vd3d3LmFudGFyYW5ld3MuY29tL2Jlcml0YS8zNDE1OTQ3L2xvZ2lzdGlrLXdzYmstbWFuZGFsaWthLWRpYmF3YS1ndW5ha2FuLWR1YS1wZXNhd2F00gFeaHR0cHM6Ly9tLmFudGFyYW5ld3MuY29tL2FtcC9iZXJpdGEvMzQxNTk0Ny9sb2dpc3Rpay13c2JrLW1hbmRhbGlrYS1kaWJhd2EtZ3VuYWthbi1kdWEtcGVzYXdhdA?oc=5&hl=en-ID&gl=ID&ceid=ID:en,Logistik WSBK Mandalika dibawa gunakan dua Pesawat - ANTARA,,,ANTARA,Logistik WSBK Mandalika dibawa gunakan dua Pesawat  ANTARA,"Mon, 27 Feb 2023 08:00:00 GMT"
Muhaimin Iskandar,https://news.google.com/rss/articles/CBMib2h0dHBzOi8vd3d3LmFudGFyYW5ld3MuY29tL2Jlcml0YS8zNDIyMTkzL2Jta2ctd2FzcGFkYS1wb3RlbnNpLWFuZ2luLWtlbmNhbmctcGFkYS1wZXJhbGloYW4tbXVzaW0tZGktdGltdXItYWNlaNIBcWh0dHBzOi8vbS5hbnRhcmFuZXdzLmNvbS9hbXAvYmVyaXRhLzM0MjIxOTMvYm1rZy13YXNwYWRhLXBvdGVuc2ktYW5naW4ta2VuY2FuZy1wYWRhLXBlcmFsaWhhbi1tdXNpbS1kaS10aW11ci1hY2Vo?oc=5&hl=en-ID&gl=ID&ceid=ID:en,BMKG: Waspada potensi angin kencang pada peralihan musim di timur Aceh - ANTARA,,,ANTARA,BMKG: Waspada potensi angin kencang pada peralihan musim di timur Aceh  ANTARA,"Thu, 02 Mar 2023 08:00:00 GMT"
Muhaimin Iskandar,https://news.google.com/rss/articles/CBMicWh0dHBzOi8va2JhbmV3cy5jb20vc2VuZ2dhbmcvZGlyZXZpdGFsaXNhc2ktc2FhdC1hbmllcy1ndWJlcm51ci1ka2ktdGViZXQtZWNvLXBhcmstcmFpaC1nZWxhci10YW1hbi1rb3RhLXRlcmJhaWsv0gEA?oc=5&hl=en-ID&gl=ID&ceid=ID:en,"Direvitalisasi Saat Anies Gubernur DKI, Tebet Eco Park Raih Gelar ... - KBA NEWS",,,KBA NEWS,"Direvitalisasi Saat Anies Gubernur DKI, Tebet Eco Park Raih Gelar ...  KBA NEWS","Wed, 01 Mar 2023 08:00:00 GMT"
Muhaimin Iskandar,https://news.google.com/rss/articles/CBMidWh0dHBzOi8vbmFzaW9uYWwudGVtcG8uY28vcmVhZC8xNjk4ODE3L2hhcmktaW5pLWRpLXRhaHVuLTE5NjAtcHJlc2lkZW4tc29la2Fybm8tYnViYXJrYW4tZHByLWhhc2lsLXBlbWlsdS0xOTU1LWtlbmFwYdIBdGh0dHBzOi8vbmFzaW9uYWwudGVtcG8uY28vYW1wLzE2OTg4MTcvaGFyaS1pbmktZGktdGFodW4tMTk2MC1wcmVzaWRlbi1zb2VrYXJuby1idWJhcmthbi1kcHItaGFzaWwtcGVtaWx1LTE5NTUta2VuYXBh?oc=5&hl=en-ID&gl=ID&ceid=ID:en,"Hari ini di Tahun 1960 Presiden Soekarno Bubarkan DPR Hasil Pemilu 1955, Kenapa? - Nasional Tempo",,,Nasional Tempo,"Hari ini di Tahun 1960 Presiden Soekarno Bubarkan DPR Hasil Pemilu 1955, Kenapa?  Nasional Tempo","Sun, 05 Mar 2023 08:00:00 GMT"
Muhaimin Iskandar,https://news.google.com/rss/articles/CBMibGh0dHBzOi8vbmFzaW9uYWwudGVtcG8uY28vcmVhZC8xNjk4MjYwL21hamVsaXMtdGluZ2dpLXBhcnRhaS1kZW1va3JhdC1rYWxhdS1tYXUtbWVuYW5nLXlhLWFuaWVzLWJhc3dlZGFuLWFoedIBa2h0dHBzOi8vbmFzaW9uYWwudGVtcG8uY28vYW1wLzE2OTgyNjAvbWFqZWxpcy10aW5nZ2ktcGFydGFpLWRlbW9rcmF0LWthbGF1LW1hdS1tZW5hbmcteWEtYW5pZXMtYmFzd2VkYW4tYWh5?oc=5&hl=en-ID&gl=ID&ceid=ID:en,"Majelis Tinggi Partai Demokrat: Kalau Mau Menang, Ya Anies Baswedan - AHY - Nasional Tempo",,,Nasional Tempo,"Majelis Tinggi Partai Demokrat: Kalau Mau Menang, Ya Anies Baswedan - AHY  Nasional Tempo","Fri, 03 Mar 2023 08:00:00 GMT"
Muhaimin Iskandar,https://news.google.com/rss/articles/CBMiMGh0dHBzOi8va2JhbmV3cy5jb20vcmVzb25hbnNpL2toYWxpc3Rhbi1yYXNodHJhL9IBAA?oc=5&hl=en-ID&gl=ID&ceid=ID:en,Khalistan Rashtra - KBA NEWS - KBA NEWS,,,KBA NEWS,Khalistan Rashtra - KBA NEWS  KBA NEWS,"Tue, 28 Feb 2023 08:00:00 GMT"
Muhaimin Iskandar,https://news.google.com/rss/articles/CBMiYGh0dHBzOi8vcmlhdS5hbnRhcmFuZXdzLmNvbS9iZXJpdGEvMzI1NzMxL3Bla2FuYmFydS10dXR1cC1sYXlhbmFuLWRpc2R1a2NhcGlsLXBhc2Nha2ViYWthcmFuLW1wcNIBZGh0dHBzOi8vcmlhdS5hbnRhcmFuZXdzLmNvbS9hbXAvYmVyaXRhLzMyNTczMS9wZWthbmJhcnUtdHV0dXAtbGF5YW5hbi1kaXNkdWtjYXBpbC1wYXNjYWtlYmFrYXJhbi1tcHA?oc=5&hl=en-ID&gl=ID&ceid=ID:en,Pekanbaru tutup layanan Disdukcapil pascakebakaran MPP - ANTARA Riau,,,ANTARA Riau,Pekanbaru tutup layanan Disdukcapil pascakebakaran MPP  ANTARA Riau,"Mon, 06 Mar 2023 08:00:00 GMT"
Muhaimin Iskandar,https://news.google.com/rss/articles/CBMiV2h0dHBzOi8vbWVnYXBvbGl0YW4uYW50YXJhbmV3cy5jb20vYmVyaXRhLzIzMzMzMS9idXBhdGktc3ViYW5nLXNldHVqdWktcGVtZWthcmFuLWRhZXJhaNIBW2h0dHBzOi8vbWVnYXBvbGl0YW4uYW50YXJhbmV3cy5jb20vYW1wL2Jlcml0YS8yMzMzMzEvYnVwYXRpLXN1YmFuZy1zZXR1anVpLXBlbWVrYXJhbi1kYWVyYWg?oc=5&hl=en-ID&gl=ID&ceid=ID:en,Bupati Subang setujui pemekaran daerah - ANTARA Megapolitan,,,ANTARA Megapolitan,Bupati Subang setujui pemekaran daerah  ANTARA Megapolitan,"Sat, 04 Mar 2023 08:00:00 GMT"
Muhaimin Iskandar,https://news.google.com/rss/articles/CBMicmh0dHBzOi8vbWV0cm8uc2luZG9uZXdzLmNvbS9yZWFkLzEwMzkwOTEvMTcxL3Blbmd1cnVzLWRwdy1nZXJiYW5nLXRhbmktZGtpLXBlcmlvZGUtMjAyMy0yMDI4LWRpa3VrdWhrYW4tMTY3ODAyNDk4NtIBdmh0dHBzOi8vbWV0cm8uc2luZG9uZXdzLmNvbS9uZXdzcmVhZC8xMDM5MDkxLzE3MS9wZW5ndXJ1cy1kcHctZ2VyYmFuZy10YW5pLWRraS1wZXJpb2RlLTIwMjMtMjAyOC1kaWt1a3Voa2FuLTE2NzgwMjQ5ODY?oc=5&hl=en-ID&gl=ID&ceid=ID:en,Pengurus DPW Gerbang Tani DKI Periode 2023-2028 Dikukuhkan - SINDOnews Metro,,,SINDOnews Metro,Pengurus DPW Gerbang Tani DKI Periode 2023-2028 Dikukuhkan  SINDOnews Metro,"Sun, 05 Mar 2023 08:00:00 GMT"
Muhaimin Iskandar,https://news.google.com/rss/articles/CBMiZ2h0dHBzOi8vamFtYmVyaXRhLmNvbS9yZWFkLzIwMjMvMDIvMjYvNTk3NzE0OS8zLXB1Ymxpay1maWd1ci1pbmktY2F3YXByZXMtZmF2b3JpdC1kaS1qYW1iaS12ZXJzaS1wdXRpbi_SAQA?oc=5&hl=en-ID&gl=ID&ceid=ID:en,3 Publik Figur Ini Cawapres Favorit Di Jambi Versi PUTIN - Jamberita.com,,,Jamberita.com,3 Publik Figur Ini Cawapres Favorit Di Jambi Versi PUTIN  Jamberita.com,"Sun, 26 Feb 2023 08:00:00 GMT"
Muhaimin Iskandar,https://news.google.com/rss/articles/CBMiZGh0dHBzOi8vcmlhdS5hbnRhcmFuZXdzLmNvbS9iZXJpdGEvMzI1NDI1L2xhbnRpay1rYXNpcGlkc3VzLWRhbi1rYXNpZGF0dW4taW5pLXBlc2FuLWthamFyaS1wZWthbmJhcnXSAWhodHRwczovL3JpYXUuYW50YXJhbmV3cy5jb20vYW1wL2Jlcml0YS8zMjU0MjUvbGFudGlrLWthc2lwaWRzdXMtZGFuLWthc2lkYXR1bi1pbmktcGVzYW4ta2FqYXJpLXBla2FuYmFydQ?oc=5&hl=en-ID&gl=ID&ceid=ID:en,"Lantik Kasipidsus dan Kasidatun, ini pesan Kajari Pekanbaru - ANTARA Riau",,,ANTARA Riau,"Lantik Kasipidsus dan Kasidatun, ini pesan Kajari Pekanbaru  ANTARA Riau","Thu, 02 Mar 2023 08:00:00 GMT"
Muhaimin Iskandar,https://news.google.com/rss/articles/CBMiU2h0dHBzOi8vdGVrbm8udGVtcG8uY28vcmVhZC8xNjk4OTQ4L2NhcmEtbWVuZ2F0YXNpLWluc3RhZ3JhbS1nYWdhbC1sb2dpbi15YW5nLW11ZGFo0gFSaHR0cHM6Ly90ZWtuby50ZW1wby5jby9hbXAvMTY5ODk0OC9jYXJhLW1lbmdhdGFzaS1pbnN0YWdyYW0tZ2FnYWwtbG9naW4teWFuZy1tdWRhaA?oc=5&hl=en-ID&gl=ID&ceid=ID:en,Cara Mengatasi Instagram Gagal Login yang Mudah - Tekno Tempo,,,Tekno Tempo,Cara Mengatasi Instagram Gagal Login yang Mudah  Tekno Tempo,"Mon, 06 Mar 2023 08:00:00 GMT"
Muhaimin Iskandar,https://news.google.com/rss/articles/CBMigQFodHRwczovL2Jpc25pcy50ZW1wby5jby9yZWFkLzE2OTc4NDAvZ2FyYXAtdG9sLXRyYW5zLXN1bWF0ZXJhLWluZHJhbGF5YS1wcmFidW11bGloLXNlcGFuamFuZy02NDUta20tcHQtaGtpLWd1bmFrYW4tdGVrbmlrLWdlb2ZvYW3SAYABaHR0cHM6Ly9iaXNuaXMudGVtcG8uY28vYW1wLzE2OTc4NDAvZ2FyYXAtdG9sLXRyYW5zLXN1bWF0ZXJhLWluZHJhbGF5YS1wcmFidW11bGloLXNlcGFuamFuZy02NDUta20tcHQtaGtpLWd1bmFrYW4tdGVrbmlrLWdlb2ZvYW0?oc=5&hl=en-ID&gl=ID&ceid=ID:en,"Garap Tol Trans Sumatera Indralaya-Prabumulih Sepanjang 64,5 Km, PT HKI Gunakan Teknik Geofoam - Bisnis Tempo.co",,,Bisnis Tempo.co,"Garap Tol Trans Sumatera Indralaya-Prabumulih Sepanjang 64,5 Km, PT HKI Gunakan Teknik Geofoam  Bisnis Tempo.co","Thu, 02 Mar 2023 08:00:00 GMT"
Muhaimin Iskandar,https://news.google.com/rss/articles/CBMiTGh0dHBzOi8vd3d3LnRyaWJ1bm5ld3MuY29tL3RyaWJ1bm5lcnMvMjAyMy8wMi8yNy9oYWJpcy1zYW1iby10ZXJiaXRsYWgtbWFyaW_SAU5odHRwczovL20udHJpYnVubmV3cy5jb20vYW1wL3RyaWJ1bm5lcnMvMjAyMy8wMi8yNy9oYWJpcy1zYW1iby10ZXJiaXRsYWgtbWFyaW8?oc=5&hl=en-ID&gl=ID&ceid=ID:en,"Habis Sambo, Terbitlah Mario - Tribunnews.com",,,Tribunnews.com,"Habis Sambo, Terbitlah Mario  Tribunnews.com","Mon, 27 Feb 2023 08:00:00 GMT"
Muhaimin Iskandar,https://news.google.com/rss/articles/CBMiXWh0dHBzOi8vd3d3Lmpwbm4uY29tL25ld3MvZWxrYW4tYmFnZ290dC1tYWluLWRpLXNlYS1nYW1lcy0yMDIzLWJlZ2luaS1wZW5qZWxhc2FuLWluZHJhLXNqYWZyadIBX2h0dHBzOi8vbS5qcG5uLmNvbS9hbXAvbmV3cy9lbGthbi1iYWdnb3R0LW1haW4tZGktc2VhLWdhbWVzLTIwMjMtYmVnaW5pLXBlbmplbGFzYW4taW5kcmEtc2phZnJp?oc=5&hl=en-ID&gl=ID&ceid=ID:en,Elkan Baggott Main di SEA Games 2023? Begini Penjelasan Indra Sjafri - JPNN.com,,,JPNN.com,Elkan Baggott Main di SEA Games 2023? Begini Penjelasan Indra Sjafri  JPNN.com,"Fri, 03 Mar 2023 08:00:00 GMT"
Muhaimin Iskandar,https://news.google.com/rss/articles/CBMifWh0dHBzOi8vdHJhdmVsLnRlbXBvLmNvL3JlYWQvMTY5NjYzNi90aW5nYWxhbi1qdW1lbmVuZ2FuLXBlcnRhbWEta2dwYWEtbWFuZ2t1bmVnYXJhLXgtYWRhLWtpcmFiLWJ1ZGF5YS1kZW5nYW4tcmF0dXNhbi1wZXNlcnRh0gF8aHR0cHM6Ly90cmF2ZWwudGVtcG8uY28vYW1wLzE2OTY2MzYvdGluZ2FsYW4tanVtZW5lbmdhbi1wZXJ0YW1hLWtncGFhLW1hbmdrdW5lZ2FyYS14LWFkYS1raXJhYi1idWRheWEtZGVuZ2FuLXJhdHVzYW4tcGVzZXJ0YQ?oc=5&hl=en-ID&gl=ID&ceid=ID:en,"Tingalan Jumenengan Pertama KGPAA Mangkunegara X, Ada Kirab Budaya dengan Ratusan Peserta - Travel Tempo.co",,,Travel Tempo.co,"Tingalan Jumenengan Pertama KGPAA Mangkunegara X, Ada Kirab Budaya dengan Ratusan Peserta  Travel Tempo.co","Tue, 28 Feb 2023 08:00:00 GMT"
Muhaimin Iskandar,https://news.google.com/rss/articles/CBMihQFodHRwczovL2Jpc25pcy50ZW1wby5jby9yZWFkLzE2OTkxMDcvZWtvLWRhcm1hbnRvLWtlcmFwLXBhbWVyLWtla2F5YWFuLWluaS1kYWZ0YXItcmluY2lhbi1nYWppLWRhbi10dW5qYW5nYW4tcGVqYWJhdC1kaXRqZW4tYmVhLWN1a2Fp0gGEAWh0dHBzOi8vYmlzbmlzLnRlbXBvLmNvL2FtcC8xNjk5MTA3L2Vrby1kYXJtYW50by1rZXJhcC1wYW1lci1rZWtheWFhbi1pbmktZGFmdGFyLXJpbmNpYW4tZ2FqaS1kYW4tdHVuamFuZ2FuLXBlamFiYXQtZGl0amVuLWJlYS1jdWthaQ?oc=5&hl=en-ID&gl=ID&ceid=ID:en,"Eko Darmanto Kerap Pamer Kekayaan, Ini Daftar Rincian Gaji dan Tunjangan Pejabat Ditjen Bea Cukai - Bisnis Tempo.co",,,Bisnis Tempo.co,"Eko Darmanto Kerap Pamer Kekayaan, Ini Daftar Rincian Gaji dan Tunjangan Pejabat Ditjen Bea Cukai  Bisnis Tempo.co","Mon, 06 Mar 2023 08:00:00 GMT"
Muhaimin Iskandar,https://news.google.com/rss/articles/CBMiggFodHRwczovL2Jpc25pcy50ZW1wby5jby9yZWFkLzE2OTg5MzMva2lsYXMtYmFsaWsta2ViYWthcmFuLWRlcG8tcGVydGFtaW5hLXBsdW1wYW5nLTIwMDktcGVueWViYWIta29yYmFuLWppd2EtaGluZ2dhLXRvdGFsLWtlcnVnaWFu0gGBAWh0dHBzOi8vYmlzbmlzLnRlbXBvLmNvL2FtcC8xNjk4OTMzL2tpbGFzLWJhbGlrLWtlYmFrYXJhbi1kZXBvLXBlcnRhbWluYS1wbHVtcGFuZy0yMDA5LXBlbnllYmFiLWtvcmJhbi1qaXdhLWhpbmdnYS10b3RhbC1rZXJ1Z2lhbg?oc=5&hl=en-ID&gl=ID&ceid=ID:en,"Kilas Balik Kebakaran Depo Pertamina Plumpang 2009: Penyebab, Korban Jiwa hingga Total Kerugian - Bisnis Tempo.co",,,Bisnis Tempo.co,"Kilas Balik Kebakaran Depo Pertamina Plumpang 2009: Penyebab, Korban Jiwa hingga Total Kerugian  Bisnis Tempo.co","Sun, 05 Mar 2023 08:00:00 GMT"
Muhaimin Iskandar,https://news.google.com/rss/articles/CBMikAFodHRwczovL2Jhbmphcm1hc2luLnRyaWJ1bm5ld3MuY29tLzIwMjMvMDMvMDIvc2V0YWh1bi1sZWJpaC1hdGFwLW1hc2ppZC1hbC1ha2Jhci1iYWxhbmdhbi1ib2Nvci1tYXJib3QtbGV0YWtrYW4tYmFueWFrLWJhay1wZW5hbXB1bmctdGV0ZXNhbi1haXLSAZQBaHR0cHM6Ly9iYW5qYXJtYXNpbi50cmlidW5uZXdzLmNvbS9hbXAvMjAyMy8wMy8wMi9zZXRhaHVuLWxlYmloLWF0YXAtbWFzamlkLWFsLWFrYmFyLWJhbGFuZ2FuLWJvY29yLW1hcmJvdC1sZXRha2thbi1iYW55YWstYmFrLXBlbmFtcHVuZy10ZXRlc2FuLWFpcg?oc=5&hl=en-ID&gl=ID&ceid=ID:en,"Setahun Lebih Atap Masjid Al Akbar Balangan Bocor, Marbot Letakkan Banyak Bak Penampung Tetesan Air - Banjarmasin Post",,,Banjarmasin Post,"Setahun Lebih Atap Masjid Al Akbar Balangan Bocor, Marbot Letakkan Banyak Bak Penampung Tetesan Air  Banjarmasin Post","Thu, 02 Mar 2023 08:00:00 GMT"
Muhaimin Iskandar,https://news.google.com/rss/articles/CBMiXGh0dHBzOi8vYmlzbmlzLnRlbXBvLmNvL3JlYWQvMTY5ODc1OC9ra3AtZ2VsYXItdGhyaXZlLWV4cG8tdW1rbS1rZWxhdXRhbi1kYW4tcGVyaWthbmFuLWJlc29r0gFbaHR0cHM6Ly9iaXNuaXMudGVtcG8uY28vYW1wLzE2OTg3NTgva2twLWdlbGFyLXRocml2ZS1leHBvLXVta20ta2VsYXV0YW4tZGFuLXBlcmlrYW5hbi1iZXNvaw?oc=5&hl=en-ID&gl=ID&ceid=ID:en,KKP Gelar Thrive Expo UMKM Kelautan dan Perikanan Besok - Bisnis Tempo.co,,,Bisnis Tempo.co,KKP Gelar Thrive Expo UMKM Kelautan dan Perikanan Besok  Bisnis Tempo.co,"Sun, 05 Mar 2023 08:00:00 GMT"
Muhaimin Iskandar,https://news.google.com/rss/articles/CBMic2h0dHBzOi8vdHJhdmVsLnRlbXBvLmNvL3JlYWQvMTY5ODAwNS9oYXJpLWphZGktcHVyYS1tYW5na3VuZWdhcmFuLWRpaXNpLWZlc3RpdmFsLW11c2lrLWRhbi1rdWxpbmVyLWNhdGF0LXRhbmdnYWxueWHSAXJodHRwczovL3RyYXZlbC50ZW1wby5jby9hbXAvMTY5ODAwNS9oYXJpLWphZGktcHVyYS1tYW5na3VuZWdhcmFuLWRpaXNpLWZlc3RpdmFsLW11c2lrLWRhbi1rdWxpbmVyLWNhdGF0LXRhbmdnYWxueWE?oc=5&hl=en-ID&gl=ID&ceid=ID:en,"Hari Jadi Pura Mangkunegaran Diisi Festival Musik dan Kuliner, Catat Tanggalnya - Travel Tempo.co",,,Travel Tempo.co,"Hari Jadi Pura Mangkunegaran Diisi Festival Musik dan Kuliner, Catat Tanggalnya  Travel Tempo.co","Fri, 03 Mar 2023 08:00:00 GMT"
Muhaimin Iskandar,https://news.google.com/rss/articles/CBMiYGh0dHBzOi8vb3RvbW90aWYudGVtcG8uY28vcmVhZC8xNjk3ODMwL3NwZXNpZmlrYXNpLWplZXAtd3JhbmdsZXItcnViaWNvbi15YW5nLXBlcmx1LWFuZGEta2V0YWh1adIBX2h0dHBzOi8vb3RvbW90aWYudGVtcG8uY28vYW1wLzE2OTc4MzAvc3Blc2lmaWthc2ktamVlcC13cmFuZ2xlci1ydWJpY29uLXlhbmctcGVybHUtYW5kYS1rZXRhaHVp?oc=5&hl=en-ID&gl=ID&ceid=ID:en,Spesifikasi Jeep Wrangler Rubicon yang Perlu Anda Ketahui - Otomotif Tempo,,,Otomotif Tempo,Spesifikasi Jeep Wrangler Rubicon yang Perlu Anda Ketahui  Otomotif Tempo,"Thu, 02 Mar 2023 08:00:00 GMT"
